,text,label
5991,jquery form plugin & programmatic submit,ajax
5992,Concurrent sum,excel
5993,Find file launching a process,bash
5994,Is there a way to force traffic comin from www.abc.com to go to abc.com via htaccess or dns?,apache
5995,Callback for Button in QtCreator?,qt
5996,Do I have to delete it? [Qt],qt
5997,"In bash, how does one clear the current input?",bash
5998,Problem (bug?) loading hexadecimal data into MATLAB,matlab
5999,Select count(*) from multiple tables,oracle
6001,How to set up Drupal default front page (view) to open in other language than default,drupal
6002,collate 500 excel sheets into database,excel
6004,different template for different categories in magento,magento
6006,What is the fastest way to insert data into an Oracle table?,oracle
6009,"Referencing an Excel address within a cell, but also additional text",excel
6010,Using j2ep on an apache-tomcat cluster - design help,apache
6011,Matlab get file size,matlab
6013,How to show the Logged Messages window in Xcode,cocoa
6014,Why toInteger :: Int -> Integer is lazy?,haskell
6015,Remove newline character from first line of NSString,cocoa
6017,"How to create a bold, red text label in Qt?",qt
6018,Ever need to parse the svn log for files committed by a particular user since a certain date?,svn
6019,Use of Haskell state monad a code smell?,haskell
6020,Adding a Custom Widget to Qt Designer,qt
6022,Return value of nth or last match,excel
6023,Access denied  Tortoise SVN 64 bits,svn
6024,Moving from VSS to SVN,svn
6025,SharePoint Web Service Credentials,sharepoint
6026,QT: custom widget in QScrollArea,qt
6027,WSS 3.0 Multiple Domains,sharepoint
6028,Performance effect of enabling apache response time log directive,apache
6029,Progressive Enhancement,ajax
6030,Esc and Enter keys in Cocoa dialog,cocoa
6032,Excel vba: error hiding calculated field in Pivot tale,excel
6034,qt cannot open input file 'c:\Qt\qt\lib\qtmaind.lib',qt
6035,Negate Unsigned Number in Bash,bash
6036,AJAX presentation ideas!!,ajax
6037,Customizing default.master in WSS 3.0,sharepoint
6038,Magento - Paypal Express 404 Error,magento
6039,Excel document recovery,excel
6040,unable to bind a signal to a slot in QT,qt
6041,Dealing with large files in Haskell,haskell
6044,Magento Custom Module database query,magento
6045,How do I create image roll over nav buttons in Wordpress,wordpress
6046,Lists in Haskell : data type or abstract data type?,haskell
6047,Keep formatting on an excel cell,excel
6049,How do I test if a column equals empty_clob() in Oracle?,oracle
6050,Qt does not create output files in debug/release folders in Linux,qt
6051,Building the Multimedia Module of Qt Mobilty with QML Extensions,qt
6052,"In SharePoint 2007, how can I have one list displayed on two different sites/workspaces?",sharepoint
6056,Capture console output for debugging in VS?,visual-studio
6057,Excel formula to determine cell ID when a series of numbers turns negative,excel
6058,drupal cck image_field and imagecache,drupal
6059,Magento: Multiple calls to same block template with cache on,magento
6061,Errors in Windows Forms controls in designer view,visual-studio
6062,Remove white backgrounds from images,cocoa
6064,how do i get a checkbox item from a QTableView and QStandardItemModel alone?,qt
6065,Good Syntax Highlighter For Self-Hosted WordPress Blog,wordpress
6067,SharePoint Visual Studio document upload Web Test fails with Connot close stream until all bytes are written,sharepoint
6068,"What's the difference between [A,B] and [A;B] in MatLab?",matlab
6070,Batch Renaming with Bash,bash
6071,First non-empty cell in a spreadsheet row,excel
6073,svn merge with revision not doing what I expect,svn
6074,Exception handling in Ajax Calls.,ajax
6075,Why does my Out of the Box SharePoint Navigation look like it is leaking memory,sharepoint
6076,asp.net ajax 4.0 with MVC -externalize templates,ajax
6077,Magento Store - Add nofollow to Layered Navigatio,magento
6078,Bash: Subprocess access variables,bash
6082,Magento: Can you set it so all Websites share the same order increment id sequence?,magento
6083,AJAX progress bar dispaying loading progress percentage for page load,ajax
6085,Clean up before closing the QCoreApplication.,qt
6086,How to define persistent variable in SQL*PLUS,oracle
6087,Wordpress support,wordpress
6088,How do I convince my team to drop sourcesafe and move to SVN?,svn
6089,Sharepoint 2007 maintenance and staging,sharepoint
6091,How to have an NSMenu with dynamic actions,cocoa
6093,Can I make QCompleter complete inline and show a popup.,qt
6094,Download attachments in one file,drupal
6095,"In Drupal 6, is there a way to take a custom field from the latest post to a taxonomy term, and display it in a view?",drupal
6097,How to GZip every file separately,bash
6098,Ajax Response from  CGI program,ajax
6099,How to get Model errors in AjaxSubmit?,ajax
6100,Oracle SQL Developer not responsive when trying to view tables (or suggest an Oracle Mac client),oracle
6102,How to refer dynamically to another database user?,oracle
6105,Tool in Visual Studio 2008 for helping with Localization,visual-studio
6106,Purposefully Slow Function,matlab
6107,Crucial Drupal Modules for Dynamic Site Development,drupal
6109,Best tools for AJAX,ajax
6110,"Using Apache Rewrite to go from HTTP to HTTPS and vice-versa, but I get a 302 response and my app errors out.",apache
6111,NSDateFormatter won't parse dates using locale settings?,cocoa
6112,Appropriate VS Project for Multiple .Net Sites,visual-studio
6113,Making a drupal database call using ajax,drupal
6114,Wordpress Seo features,wordpress
6115,How to use AJAX in DRUPAL,drupal
6116,Matlab book on geometry and image processing,matlab
6118,Drupal: add contact form as field to user profile,drupal
6119,CAML query to locate specific SPFolder nested in document library tree,sharepoint
6120,parsec-3.1.0 with custom token datatype,haskell
6121,Cannot access new product attributes in grid display,magento
6122,Linking Simple product to their page listed under Grouped product in Magento,magento
6123,Right click on sheet-tabs disabled in Excel,excel
6124,Accessing URL parameters in Oracle Forms / OC4J,oracle
6126,Excel function to determine the last Friday in a month,excel
6127,Oracle Associative Array TYPE is not able to use in USING statement (If  TYPE is declared within Package),oracle
6128,Tool for translation of Oracle PL/SQL into Postgresql PL/pgSQL,oracle
6129,Wordpress get_post_meta,wordpress
6131,Problem running my project in IE 6.0 and 7.0 (window.location)?,ajax
6133,Protect excel file with java,excel
6135,matlab 2009 creating symbol,matlab
6137,good stand-alone svn client,svn
6138,Excel OpenText method,excel
6139,What does the Alias attribute of FieldRef do?,sharepoint
6140,Bash Case menu - dynamic choices,bash
6142,Override SPList.WriteSecurity behaviour?,sharepoint
6143,Haskell type error: Could not deduce (Show a) arising from a use of `show' from the context (Num a),haskell
6145,Loop through PageField in OLAP Cube [PivotTable],excel
6146,Check each pixel for a specific colour (within a certain threshold),matlab
6147,Setting expires header for a specific URI?,apache
6149,WordPress functions.php Problem,wordpress
6151,Passing a native pointer to performSelectorOnMainThread's withObject argument?,cocoa
6152,"AJAX readystate breaking, AJAX not processing data fast enough?",ajax
6153,Is QHash::contains method case-sensitive or case-incensitive?,qt
6154,Help Understanding Arrows in Haskell,haskell
6156,how will you take only stored procedure backup in oralce 10g?,oracle
6157,Is anyone using valgrind and Qt ?,qt
6158,Troubles after installing Two stores with same php docroot,magento
6159,One Sharepoint Feature or many inter dependant ones,sharepoint
6160,Primitive recursion,haskell
6163,[MAGENTO] How to use an external lib? (PclZip),magento
6165,Inserting a custom_field in Wordpress using MySql,wordpress
6167,AJAX/NPH Scripts under Apache 2.2.9 - without the nph-name preface?,apache
6168,Apache reverse proxy set up secure certificate,apache
6170,AJAX C# AutoCompleteExtender contextKey,ajax
6171,Is there an easier way to add menu items to a wordpress navigation menu?,wordpress
6173,Question about what I should have before Connect,qt
6175,Example of using AuthType Digest to authenticate a user once across sub-domains?,apache
6176,Global object for Javascript to interact with Safari plug-in,cocoa
6178,Wordpress: add a custom field option that's available to all posts,wordpress
6181,What is the best way to do server-side output caching PHP?,apache
6182,Drupal incorrectly espaces tags in javascript,drupal
6183,Getting Excel 2003 to interpret a pasted number with leading zeros as text (works fine in 2007),excel
6184,JavaScript developer looking for insperation from frameworks such as cocoa,cocoa
6185,How would you set up an Subversion repository for in house software projects,svn
6186,"In excel automation, how to gracefully handle invalid file format error upon file opening?",excel
6187,Magento - Strange symbol in the invoice's PDF,magento
6188,What is the bullet-proof way to specify the Easy Connect string for Oracle?,oracle
6189,Problem with flooding menu?,ajax
6190,How do you move a file in SVN?,svn
6192,recursively add file extension to all files,bash
6194,Using a formula from another column in Excel,excel
6195,The Matlab equivalent of pyton None,matlab
6197,Is OpenAtrium really slow?,drupal
6199,"Please confirm or correct my ""English interpretation"" of this Haskell code snippet",haskell
6200,Creating Haskell instance declarations,haskell
6201,"Copy Excel worksheets, macros, and graphs from one workbook to another, moving links to the new workbook",excel
6202,"Flex, Cairngorm and XML-RPC",magento
6206,is it possible to print all reudctions in Haskell - using WinHugs?,haskell
6207,CocCoa Application,cocoa
6208,Does Visual Studio have anything like Borland's CodeGuard?,visual-studio
6209,Run db query (sql server 2005) with ajax. Is it possible?,ajax
6210,Using MonadPlus in FRP.Reactive.FieldTrip,haskell
6211,How do I bring an Oracle BLOB into SQL Server?,oracle
6212,What stratagies are best for storing art assets in SVN?,svn
6213,htaccess rewrite,apache
6214,"Excel: mapped XML data and the ""number stored as text"" error",excel
6215,Rotating a Div Element in jQuery,ajax
6216,Wordpress [caption] processing,wordpress
6217,"Keep QPixmap copy of screen contents using X11, XDamage, XRender, and other tricks.",qt
6219,"Programmatic equivalent of ""Visible at Launch"" for NSWindows",cocoa
6220,Abort a PL/SQL program,oracle
6222,"How do I write, ""if typeclass a, then a is also an instance of b by this definition.""",haskell
6223,Magento Trying to set the session id to programmitcally add to cart,magento
6225,'Magical' QTextEdit size,qt
6226,Alternate posts in wordpress,wordpress
6228,"Can you ""ignore"" a file in Perforce?",svn
6229,Change background color of Solution Explorer in Visual Studio,visual-studio
6230,"HOWTO: rewrite requests for images, css and js to different folders for each application?",apache
6231,Reading CLOB column is slow...,oracle
6232,"AJAX: How do I make the button submit after I press ""Enter""?",ajax
6233,why we integrate Qt with visual studio,qt
6234,How to compile a simple Qt and c++ application using g++ on mac os x?,qt
6235,matlab:find the 4th vertice of a parallelogram,matlab
6237,Oracle Materialized Views Vs Replication on the same DB server,oracle
6238,Oracle - dynamic column name in select statement,oracle
6239,Observing self in Cocoa,cocoa
6240,custom form with Drupal - CCK and simple module - what next?,drupal
6241,How to merge a 64 by 64 cell into a 1 by 1 cell,matlab
6242,designing Panels without a parent Form in VS?,visual-studio
6243,Read input from a cocoa/foundation tool console?,cocoa
6244,Apache modrewrite htaccess problem,apache
6246,Change the date of wordpress,wordpress
6247,Apache/Tomcat site nesting,apache
6248,Integrating Several Drupal Sites,drupal
6250,excel workbook isolated storage,excel
6251,MVC Ajax Begin form hides submit button on ajax call,ajax
6253,mailto link sharepoint desgner,sharepoint
6254,How to get value from NSTextField(in cocoa)?,cocoa
6255,SVN externals sub folder changes not showing in view log (tortoise svn),svn
6256,How can I simulate user interaction (key press event) in QT?,qt
6258,map versus mapM behavior,haskell
6261,What's a good directory structure for large C#/C++ solutions?,visual-studio
6262,how do I extend a contributed module in drupal,drupal
6263,What are your most-recommended Visual Studio perferences?,visual-studio
6264,How to set the line where a QToolBar is displayed?,qt
6265,Where is the template file for the password protected page in wordpress?,wordpress
6267,excluding commits by specific users from svn merge,svn
6269,"QSlider focus issue (Mac Leopard) with QApplication::focusChanged(QWidget*,QWidget*)",qt
6270,How to create PDF for product description in Magento,magento
6272,Underscore before theme name,drupal
6273,Show Editors for All Cells in Row in QTableView,qt
6274,Magento Bundled Product Restrictions,magento
6275,Qt: set a default cursor for an application,qt
6277,Wordpress homepage problem,wordpress
6278,QT / thread event loop QTimer/Mysql queries,qt
6280,"Translating ""Why Functional Programming Matters"" into Haskell",haskell
6281,How to add theme settings to Zen-based themes?,drupal
6282,Why ssh fails from crontab but succedes when executed from a command line?,bash
6284,EXCEL Formula or VBA To Extract Data Based on Another Cell's Data,excel
6285,Displaing list of categories and tags — Wordpress,wordpress
6287,What about the event before order save in onepage checkout in Magento 1.4?,magento
6288,how to automatically ignore files in grep,bash
6289,Replacing an element in a n-ary tree,haskell
6292,How to avoid Excel localizing object names and breaking macros?,excel
6294,Is [[ ]] preferable over [ ] in bash scripts?,bash
6295,stm monad problem,haskell
6296,How to move an element in a list in Haskell?,haskell
6299,exception Handling in Qt Script with C++,qt
6300,Cannot pass message (or Call a function) using the outlet of a customized class,cocoa
6301,Html checkbox change value in MySql,ajax
6302,How to insert a new line character after a fixed number of characters in a file,bash
6303,Help with SVN Setup,svn
6304,Is it possible to add Web Parts to the My Profile page of My Site?,sharepoint
6305,Converting small-ish Oracle long raw values to other types,oracle
6306,How can I delay one feed in wordpress but not the others?,wordpress
6308,putting the last command's wall time in bash prompt,bash
6309,Magento - Not able to display tier pricing in product view,magento
6310,How can I assign the match of my regular expression to a variable?,bash
6311,"Automatically set list item permission, after new item is created",sharepoint
6312,SPCrossListQuery fails to bring back results,sharepoint
6313,How do I close an OracleConnection in .NET,oracle
6314,Quicksort + Profiling,haskell
6315,Plotting special function (Debye) in Matlab,matlab
6316,Apache Integration with Lisp like web language,apache
6318,hoe to draw concentric circles in an image in matlab? Please help me,matlab
6323,Managing multiple asynchronous NSURLConnection connections,cocoa
6324,product price Issue,magento
6326,Apache Mod Rewrite (.htaccess),apache
6327,magento setup problem.,magento
6328,"AJAX to do Real Time DB Polls like Twitter's ""Real Time Results"" in Coldfusion",ajax
6329,MATLAB: function makes 4 recursive calls. I have a 4-core processor. Can I parallelize?,matlab
6330,Database design - Should a Date be used as part of a primary key,oracle
6333,Drupal DATABASE deployment strategies?,drupal
6335,How can I make only some folders show up for certain developers with SVN,svn
6336,How to move documents and list items in Windows SharePoint Services?,sharepoint
6337,How do you use shell script variables as arguments to sed?,bash
6338,Drupal: Staying Organized with Module Changes,drupal
6339,How can I change the repository url using AnkhSVN 2.x,svn
6340,Dynamic UI styling/theming,ajax
6341,Visual Studio 2008 macro to switch between header and source files?,visual-studio
6342,Flipping Quicktime preview & capture,cocoa
6343,zip columns from separate files together in bash,bash
6345,ColdFusion vs PHP,ajax
6346,Haskell: Creating Type Classes for Zippers,haskell
6348,What do you do when you feel you need a variatic list comprehension?,haskell
6349,Sharepoint: Is it possible to make subgroups in top navigation menu?,sharepoint
6350,List of GHC extensions,haskell
6352,Need skeleton code to call Excel VBA from PythonWin,excel
6353,Excel through OleDb shows numbers differently...depending on whether spreadsheet is open!?,excel
6354,apache on windows virtual directory config help,apache
6357,Tools for SVN Merging,svn
6360,Any idea for running Qt signals/slots over network?,qt
6362,"How to tell Apache, in reverse proxy mode, to intercept or trap 302 responses from backend server and redirect internally without sending 302 response back to client?",apache
6364,Display os x window full screen on secondary monitor using Cocoa,cocoa
6365,MPM Prefork Apache Uses Absurd Amount of Memory,apache
6367,MATLAB - Delete elements of binary files without loading entire file,matlab
6368,wordpress wp_get_archives output change with preg_replace,wordpress
6370,What is the most elegant way to encode/decode an Object to Dictionary,cocoa
6373,SharePoint Web Parts,sharepoint
6375,Excel VBA Macro: create a chart from CSV?,excel
6376,How to do conditional compilation in Haskell?,haskell
6377,Getting the tags for a post in a Wordpress plugin,wordpress
6378,Is there a .Net interface to Oracle SQLPLUS?,oracle
6381,Visual studio addin - finding current solution folder path,visual-studio
6382,Applying mod_rewrite rules AFTER DirectoryIndex is applied,apache
6383,Get istance of Excel application with C# by Handle,excel
6385,Visual Studio Vs Visual Web Developer,visual-studio
6386,Different results when applying function to equal values,haskell
6387,Excel to XMl in .NET3.5,excel
6388,Deploying Layouts in SharePoint,sharepoint
6389,Packaging multiple features into a single WSP solution file,sharepoint
6390,how do i get a count of columns that contain data from excel,excel
6391,Upgrading from SPS 2003 to MOSS 2007,sharepoint
6393,svn create tag problem,svn
6394,Is Drupal ready for the enterprise?,drupal
6396,Turn off error messages in a bash script,bash
6397,How to add a number to a variable?,matlab
6399,Is there a way to specify a super-type sub-type relationship in Oracle Designer?,oracle
6403,Matlab copy constructor,matlab
6404,Using catalog image as full background image in Magento,magento
6405,Faster dec2bin funtion for large amount of conversion,matlab
6406,Need help choosing a framework for bilingual site,drupal
6407,Show Only Pings (Pingbacks+Trackbacks) Number on Wordpress,wordpress
6409,Comparing Two Arrays.,cocoa
6411,loading custom framework in iphone,cocoa
6412,"Lower case ""k"" in Cocoa",cocoa
6413,Qt: QGraphicsScene not updating when I would expect it to.,qt
6414,Where to manage the most sensitive content you have under version control?,svn
6415,how magento parse url?,magento
6416,Visual Studio,visual-studio
6417,Drupal: re-selecting taxonomy terms in advanced search,drupal
6418,NSMutableArray memory management,cocoa
6419,Can I rewrite from subdomain to folder avoiding redirection?,apache
6420,AJAX constantly look for server update? Javascript,ajax
6421,How do I convert Elevated Privilege code from C# to VB.Net for use with SharePoint?,sharepoint
6422,"Drupal question: Views, arguments and nodequeues",drupal
6423,Unique random number sequence using qrand() and qsrand(),qt
6424,Wordpress: Can  404.php page send values to header.php?,wordpress
6426,Howto import an oracle dump in an different tablespace,oracle
6427,Some Paramters in $.ajax not passing,ajax
6430,How do you get search capability similar to Spotlight or iTunes?,cocoa
6432,How to get real Integer Overflows in Matlab/Octave,matlab
6433,Drupal research strategy (custom or ready module),drupal
6434,SharePoint (MOSS 2007) remove user,sharepoint
6436,Wordpress dynamic navigation function for highlighting single post tabs,wordpress
6437,What is MATLAB? Does it generate executables?,matlab
6438,Apache automatically restarting itself every couple of requests,apache
6439,Solution items cross several web projects in Visual Studio,visual-studio
6440,calling user_save from within hook_init failing on Drupal6,drupal
6442,Is there a difference between installing mod_python via httpd.conf and conf.d in apache?,apache
6443,Filter and View screens on different pages,drupal
6444,Future posting with dateCreated in Wordpress via XMLRPC in Ruby,wordpress
6445,Exporting .xls to .csv issues,excel
6446,Advanced directory switching in bash,bash
6448,Get three posts before a certain date in Wordpress,wordpress
6450,what algorithm good for image matching?,matlab
6451,Oracle - How to grant to a user the rights to another user's objects,oracle
6452,How to programatically add an object to a bound NSMutableArray?,cocoa
6454,Using QFileSystemModel in a QCompleter,qt
6455,Binding ASP.NET GridView to an Oracle SYS_REFCURSOR,oracle
6456,Compiling QT-Creator with mingw,qt
6457,implementing a per-digit counter using the list monad,haskell
6458,How can I point Visual Studio 2008 to a new path for projects?,visual-studio
6460,How do I group similar catalog products (CD & mp3) on the landing page of my Ubercart store?,drupal
6462,How do I respond to an internal drag-and-drop operation using a QListWidget?,qt
6463,"Why would the browser cache assets (images, js, etc.) while GETting but re-request everything after a POST + 302 redirect?",apache
6464,How do I prevent Visual Studio from renaming my controls?,visual-studio
6465,How to hide AJAX HTML Editor Bottom Toolbar,ajax
6467,Using .inc files when theming.,drupal
6468,How do I add a header with data to a QTableWidget in Qt?,qt
6469,SharePoint - Adding users from Active Directory in a custom administration form,sharepoint
6470,How can I perform a reverse string search in Excel without using VBA?,excel
6471,redirect http to https for some page in site in APACHE,apache
6472,Default value for PivotChart Report Filter/Page Field,excel
6473,Common Types of Subversion Hooks,svn
6474,What are the cases when AJAX should not be used?,ajax
6475,Oracle TEMPORARY TABLESPACE,oracle
6478,JQuery AjaxUpload and PHP Max File Size Issue,ajax
6479,Which Visual Studio Color Theme?,visual-studio
6480,How do I run another web site or web service side by side with Sharepoint?,sharepoint
6482,No feed output when working with Friendfeed and Wordpress API?,wordpress
6483,breakpoints not working after installing valgrind,qt
6484,awk and printf in bash,bash
6486,"If a Matlab function returns a variable number of values, how can I get all of them as a cellarray, for instance?",matlab
6487,How important do you think Progressive Enhancement is?,ajax
6489,Internal Server Error,apache
6490,Validation Drop down on a condition,excel
6491,"Creating GUI application completely in QtScript, what is your opinion?",qt
6492,Overwriting a core Wordpress function - should work but it doesn't,wordpress
6493,show the order display page in new page in magento,magento
6494,Drupal: module to implement credit system,drupal
6495,adding image to the widget of magento,magento
6496,Set timeout on jQuery .load,ajax
6497,[Excel VBA]How to cast a shape object?,excel
6498,Magento layout related basic Questions ?,magento
6500,"Same Port, but different DocumentRoots",apache
6502,Validate Emails with Bash,bash
6503,stop apache injecting it's own 404 not found page to the custom 404 error page,apache
6505,Drupal: Is it possible to insert php variables from one node into another node?,drupal
6506,"Is it better to use the State Monad, or to pass state recursively?",haskell
6507,Navigation Controller strategy with an Address Book picker,cocoa
6509,Best way to select the id of the matching row with the most recent timestamp,oracle
6510,PHP using too much memory,apache
6512,How much math do I need to become productive in Haskell?,haskell
6515,Keyword highlighting on selection in Visual Studio 2008,visual-studio
6516,My jquery ajax form will not post,ajax
6517,Call Excel Add-In function from Excel workbook VSTO,excel
6518,How to change listing language in Magento,magento
6519,How can I implement a blocking process in a single slot without freezing the GUI?,qt
6520,difference between a User and a Schema in Oracle?,oracle
6522,Oracle 10gr2: ensure timestamps are between 9am and 5pm,oracle
6523,Haskell: Overlapping instances,haskell
6525,[Haskell] Odd values when enumerating a list,haskell
6526,Anyone have commit notification hook script that will send email upon commit of codes?,svn
6528,What is the best way of generating a xslx file on a web site? Possibly with millions of rows?,excel
6529,What to do when 'svn cleanup' fails?,svn
6530,Help with wordpress and adding jquery please,wordpress
6532,Can I block search crawlers for every site on an Apache web server?,apache
6534,How To Removing Trailing Whitespace Of All Files Recursively?,bash
6535,Can I use a QTimer to periodically refresh a form while still letting user edit some of the fields?,qt
6536,How to determine if a table has been accessed in the last month?,oracle
6538,Nesting Apache Tiles Template,apache
6539,What is MACID ?,haskell
6541,How do you add context senstive menu to NSOutlineView (ie right click menu),cocoa
6545,Debug irrelevant Wordpress search results,wordpress
6546,How to improve performance in Oracle using SELECT DISTINCT,oracle
6547,Haskell pixel drawing library linux,haskell
6548,CAML to HTML,sharepoint
6549,SET game odds simulation (MATLAB),matlab
6550,Drupal - open node body in new window,drupal
6552,How to stop VS2008 trying to compile .ASP pages as Visual Basic?,visual-studio
