,text,label
8736,How to export a part of SVN repository with dependencies?,svn
8738,"How to make an iTunes like (playlists, library) left-sided (collapsible) navigation bar?",cocoa
8739,QTextEditor returns quotes(,qt
8740,How to graythresh a indexed image in matlab?,matlab
8742,CSS Layout not working in IE7 (all other browsers are fine),drupal
8744,How to check if an ajax function is busy from a previouse call,ajax
8746,How to prevent libQtGui.so and libQtCore.so from being linked to a simple library built with qmake,qt
8747,Detecting center point of cross using Matlab,matlab
8748,Looking for advice on the best way to show BIRT reports in Drupal,drupal
8750,Query in Shell Script,bash
8751,Using ASP.Net ajax library for cross browser Xml manipulation,ajax
8752,Securing AJAX Requests via GUID,ajax
8753,Drupal wizard form: Validation and previous button,drupal
8754,Apache/PHP - alias outgoing URL,apache
8755,bash script to restart Apache automatically,bash
8756,"matching a line with a literal asterisk ""*"" in grep",bash
8758,Magento - How to rewrite /app/design/frontend/default/default/template/customer/form/register.phtml,magento
8759,NSFileHandle readInBackgroundAndNotify does not work,cocoa
8760,GUI Toolkit for ASP.net,ajax
8761,Wordpress : is it possible to connect $wpdb class into other database ?,wordpress
8763,Passing arrays as parameters in bash,bash
8764,Best solution for Java web based forms connected to Oracle plus JNI?,oracle
8765,Why do my Wordpress comments have the wrong date?,wordpress
8766,Why can't GHCi resolve the kind of [[]] ?,haskell
8767,JQGrid url action not firing when using Ajax.BeginForm,ajax
8768,Qt4.5: Using event-loop based localsocket before app.exec,qt
8769,"Customizing SharePoint's NewForm.aspx, or creating my own form... thoughts?",sharepoint
8770,"Modifying Qt core components/widgets, best practices?",qt
8772,Core Animation View Intermittently Not Appearing,cocoa
8774,Query to show images with recent posts in Wordpress sidebar/widget,wordpress
8775,Is there a way of selecting the contents of a ref cursor as part of a SQL Select statement?,oracle
8776,How to clear PHP $_SESSION by apache?,apache
8780,Drupal CCK add another item callback,drupal
8781,How can I cut(1) camelcase words?,bash
8782,Using Revision Control  for home development,svn
8785,Best way to migrate from VSS to Subversion?,svn
8786,Bandwidth throttling for Apache<2.2 on Windows (mod_throttle?),apache
8787,"[MAGENTO] Index page is way too slow, what can I do?",magento
8789,NSTableView selection & highlights,cocoa
8790,Recover files from old Subversion backup,svn
8791,Database history for client usage,oracle
8792,How to change style for nodes in NSOutlineView?,cocoa
8793,Macro to wrap selected with tags in Visual Studio,visual-studio
8795,Linux sockets communicating with QTcpSockets in Qt 4,qt
8797,writing bash script to change text and write to a log,bash
8798,Euler Problem in Haskell -- Can Someone Spot My Error,haskell
8799,Is it possible to customize the colors of RockScroll's variable syntax highlighting?,visual-studio
8800,Complete Haskore example,haskell
8802,Local copy of SVN repository,svn
8804,Graphical representation of SVN branch/merge activity,svn
8805,Where is the setCouponCode function is defined in Magento,magento
8806,Including javascript in a drupal page or form,drupal
8807,Haskell - specyfing kind in data declaration,haskell
8808,Magento - 2 or more observer on same event,magento
8809,Views doesn't show checkbox fields where answer > 1,drupal
8810,Confirm bug Magento 1.4 'show/hide editor' in CMS,magento
8811,How to Create a Managed Path through SharePoint Object Model,sharepoint
8813,using load instead of other I/O command,matlab
8814,How can I block mp3 crawlers from my website under Apache?,apache
8815,SQLSTATE[42S02]: Base table or view not found:,magento
8817,insert in the head tag after wp_head,wordpress
8819,Personal Version Controller,svn
8820,Magento frontend and backend page looks different,magento
8821,"How can I format bytes a cell in Excel as KB, MB, GB etc?",excel
8822,Could someone explain these Haskell functions to me?,haskell
8823,Adding deriving(Data) to standard types,haskell
8826,xargs doesn't recognize bash aliases,bash
8828,Open External Browser from QWebView,qt
8829,What Block Type for Left Column in Magento Theme?,magento
8831,remove particular order status from list in magento,magento
8832,Installing a VBA macro in Excel 2007,excel
8833,SPGridview single DataKeyName instead for multiple?,sharepoint
8834,WordPress Database,wordpress
8837,A popup in an Modal window to replace JS confirm and alert - ASP.NET,ajax
8838,Any way to rename image filenames?,drupal
8839,Grabbing every 4th file,bash
8841,"Drupal State Machines, usage and alternatives",drupal
8842,rails ajax update only once,ajax
8843,Inserting a jfree chart in excel using jsp,excel
8846,How to circumvent the depth limitation of Excel's IF function?,excel
8848,How can I resize an NSTextField to fit the text that it holds?,cocoa
8849,Fewer connections in a Qt calculator,qt
8850,How could I use the QColorDialog widget inside another widget not as a separate dialog?,qt
8853,Change Ads automatically Drupal Ad module,drupal
8854,Odd problem using addObserver:forKeypath:options:context: in init method,cocoa
8857,"How to set ""Folders"" properties in Sharepoint View",sharepoint
8858,Why is Magento trying to call in the Mage namespace rather than my custom namespace?,magento
8859,Keyboard and mouse event transparent widget,qt
8860,Magento Debugging Environment,magento
8862,Totaling figures in .csv files using Excel,excel
8863,i install Magik_Featuredproducts component in magento after install i can't access my adminpanel and front view ?,magento
8864,batch create users?,drupal
8866,Best way to let third-parties work on your site,svn
8867,Qt vs WPF/.NET,qt
8868,bash: $[<arithmetic-expression>] vs. $((<arithmetic-expression>)),bash
8869,Haskell FFI: Calling FunPtrs,haskell
8870,Magento - Layout and block,magento
8871,SharePoint OOTB Workflow Problem,sharepoint
8873,Using Apache for load balancing routing,apache
8874,trying to install hs-ffmpeg haskell package fails to find libdc1394,haskell
8875,Magento - How to display ALL PRODUCTS in the homepage?,magento
8876,magento cross selling subcategory,magento
8878,How do I convert Cocoa co-ords from top left == origin to bottom left == origin,cocoa
8879,How to view error messages from ruby CGI app on remote server?,apache
8880,What is the purpose of (Apache) putting inode into an ETag?,apache
8881,How do I view all ignored patterns set with svn:ignore recursively in an svn repository?,svn
8882,Matlab - usage of knnclassify,matlab
8883,how can i evaluate an expression?,haskell
8884,Qt ClickToFlash,qt
8886,Vsssc and Vssscc files - usefull for SVN?,svn
8887,"Bash and Mac OS X, open application in Space N",bash
8888,Bash TAB-completion inside double-quoted string,bash
8889,What is the right way to modify a wordpress query in a plugin?,wordpress
8891,Bash script plugin for Eclipse?,bash
8892,Connecting Two Bash Commands,bash
8894,How can I rename (or even remove?) buddypress' wire-section?,wordpress
8895,Testing sucess with shipping enabled vs disabled in Magento,magento
8897,Error while generating a PDF file with Excel using C# in ASP.NET,excel
8899,Search and sort data from several files,bash
8900,Saving In Magento Taking A Very Very Long Time,magento
8901,"SharePoint ""Group By"" is broken when using ""Allow Multiple Values"" for a column",sharepoint
8903,"Ajax: Partial refresh of a parent page (update a div) from ""lightbox"" window",ajax
8904,Can Visual Studio 2008 work with Team System 2005?,visual-studio
8905,Re-enabling JavaScript debugging in IE7 with Visual Studio,visual-studio
8906,"convert f(x,y) to a 2-D matrix",matlab
8907,Magento: Column not found: 1054 Unknown column 'e.display_price_group_0' after rebuilding flat catalog product,magento
8908,Magento CMS pages - getting title from URL key?,magento
8909,AJAX ComboBox Control,ajax
8911,help with Magento: Controller file was loaded but class does not exist,magento
8912,Differences between two analytic queries,oracle
8913,How to list source versions using subversion,svn
8915,google opensearch plugin ajax drop down,ajax
8916,Get log details for a specific revision number in a post-commit hook with SharpSVN?,svn
8917,Enviroment variable within variable,bash
8919,"Can two different sites running on same host, share same database for storage and retrieval?",wordpress
8922,Help documenting Javascript in Visual Studio?,visual-studio
8923,How to set up a website with WordPress ?,wordpress
8924,Proxy URL without authentication,apache
8926,Is there a tool for monitoring and annotating SVN checkins?,svn
8927,How to get all WebpartZones on a page in Sharepoint 2007?,sharepoint
8928,drupal Generate a PDF catalog from a bunch of nodes,drupal
8929,Oracle merge constants into single table,oracle
8931,Redirect 404 to another domain with apache?,apache
8932,Sort a matrix with another matrix,matlab
8933,"Re-Initializing ""ThisWorkbook.Path""",excel
8934,Can an Oracle variable of type RECORD be passed between procedures without the procedures knowing its real type?,oracle
8935,Bash or Python or Awk to match and modify files,bash
8936,How to disable personal contact form option in drupal user account creation.,drupal
8937,resolving sub-domain in apache,apache
8938,Prevent Oracle minus statement from removing duplicates,oracle
8939,svn repository path changed: how to re-bind my local folder to it?,svn
8940,How to redirect based on Accept-Language with Apache / mod_rewrite,apache
8941,Set Special Price Programatically In Magento,magento
8942,Magento Developers: Is Magento really -that- good?,magento
8944,Porting MATLAB 7 files back to 6.1,matlab
8945,Oracle SQL Developer: sharing configuration via Dropbox,oracle
8946,UNIX commands that support colours,bash
8947,chroot + execvp + bash,bash
8948,Review request and expiry notification emails for scheduled publishing pages,sharepoint
8949,Is there any way to have the JBoss connection pool reconnect to Oracle when connections go bad?,oracle
8950,How to maintain a locally modified copy of an external svn repository,svn
8951,Sharepoint: Person column in custom list,sharepoint
8952,Wordpress Term exist not having desired effect,wordpress
8953,Un-Published items showing in Drupal search results (google search appliacne),drupal
8954,How to call Matlab functions from linux command line ?,matlab
8955,Parse file upload directly without writing to the file system,apache
8956,modify comfig file using bash scirpt,bash
8957,Browser compatibility between IE6 and IE7,ajax
8958,Excel as database frontend for several concurrent users - doable?,excel
8959,How to get Visual Studio External Tools to use a currently open instance of the external tool?,visual-studio
8961,Svn full dump (moving servers),svn
8962,What does the >> symbol mean in Haskell.,haskell
8966,Cabal installing quickcheck version problem,haskell
8967,What manner of Haskell syntax is used in [$parseRoutes|/ Home GET|] ?,haskell
8968,Haskell Error: Couldn't match expected type `Integer' against inferred type `Int',haskell
8969,Is it possible to run q Qt Symbian application in the background and interact with the homescreen?,qt
8970,Oracle command-line tools on Linux,oracle
8972,Drupal Menu System - Outputting a Tree One Level Down,drupal
8973,Arabic Digits in Wordpress,wordpress
8974,What kind of category methods do you use to make Cocoa programming easier?,cocoa
8975,Multiple sections in Content Block for Drupal,drupal
8976,What is primitive recursion?,haskell
8977,Magento - Create new user returns SQLSTATE[HY000] [2002] Can't connect to local MySQL server through socket '/var/lib/mysql/mysql.sock' Help?,magento
8978,Convert image (jpg) to base64 in Excel VBA?,excel
8979,How do I create an import-only document type in Cocoa?,cocoa
8980,How can Set Current currency in paypal in magento?,magento
8981,Graph/tree representation and recursion.,matlab
8982,List all svn:externals recursively?,svn
8983,.htaccess mod-rewrite how to,apache
8984,How can I pass variables from a form within the Wordpress platform?,wordpress
8986,Avoiding sub-directory request rewrites with Apache mod_rewrite,apache
8987,"Looping Through Set Number of Posts in Wordpress, Then running same loop again on next set, etc.",wordpress
8989,Partial refunds in Magento,magento
8991,apache resolving urls before looking in .htaccess,apache
8992,Wordpress - Harvard Gazette - How did they do X ?,wordpress
8994,Use first post as start-page in wordpress,wordpress
8995,Magento Connect is not working after migration,magento
8997,Oracle stored procedure OUT parameters,oracle
8998,"Copy and paste cells if Duplicate columns , Excel Macro slightly different question",excel
8999,.NET VS2005 WinForms: How do i drop a user control onto a form?,visual-studio
9000,Elegant way to highlight chart data series in Excel,excel
9001,"On QT widgets like DoubleSpinBox or ComboBox, how do i have custom right click menu",qt
9002,Dynamic menu item in Drupal?,drupal
9005,Using update panel in AJAX a good practice in asp.net?,ajax
9006,allowing anonymous user to save contents of a form in sharepoint doc library,sharepoint
9007,magento installation,magento
9008,CodeIgniter Backend Frontend .htaccess router,apache
9009,How do I fix this apache error log issue? Mod Deflate,apache
9010,Javascript if(function_foo()) doesn't wait for function_foo() to complete,ajax
9011,How can a Qt client talk to a Spring server application?,qt
9012,How to delete files older than X hours,bash
9013,What advantages does  C++ have over other languages for Qt development?,qt
9014,SQL behind an external data query in Excel,excel
9015,Remove first 4 letters from a folder name using bash scripting,bash
9017,Does anyone commit Qt to their own source control?,qt
9018,Magento - Tag wishlist products in admin -> order,magento
9019,Binding NSSlider to control the zoom of an IKImageBrowserView,cocoa
9020,How to get notified about chnages on SharePoint groups.,sharepoint
9021,QVariant and qRegisterMetaType question,qt
9022,"Apache is not sending 304 response, if mod_deflate and AddOutputFilterByType is enabled",apache
9023,Adding a rule that checks if the user's role has changed?,drupal
9024,Programmatic positioning of VBA charts has stopped working,excel
9025,Why don't I have setTextFormat in my QTextEdit? [Qt] [C++],qt
9026,Resolving resx references,visual-studio
9027,Creating Qt models for tree views,qt
9028,Is it possible to cache a whole website including start html page and startup with no internet connection?,ajax
9029,How to send a SIGINT to Python from a bash script?,bash
9031,What is the best way to deploy a VB.NET application?,visual-studio
9032,drupal 6 can we write a php file in drupal which changes the headers,drupal
9033,How to Force Javascript to Execute within HTML Response to Ajax Request,ajax
9034,How to iterate headers of sys.net.webrequest (ajax),ajax
9035,"Magento: How to tell if you're on a category page, or product page in .phtml file(s)",magento
9036,Gridview item preview using .net 2.0,ajax
9037,Matlab: Print text in input field,matlab
9038,Apple documentation a bit lite?  tips?,cocoa
9039,Best practice with SharePoint feature deactivation,sharepoint
9041,Excel 2003 XML format - AutoFitWidth not working,excel
9042,matlab's phi symbol,matlab
9043,How hard is it to get a cocoa application to run on windows?,cocoa
9044,Sharepoint webpart and overiding the css style,sharepoint
9045,Performance of Remote Materialized views in Oracle,oracle
9047,how to  insert a tr which is deleted from another table using jquery and ajax,ajax
9048,jquery ajax not setting variable to POST,ajax
9049,How to average time intervals?,oracle
9050,What are you favourite Matlab/Octave programming tricks?,matlab
9051,What is the dual table in Oracle?,oracle
9053,PHP regex expression for the following...,wordpress
9054,awk without printing newline,bash
9055,Change value for multiple cells in Excel,excel
9056,How do you strip leading spaces in Oracle?,oracle
9057,How do I prevent a subversion user accessing part of the repository?,svn
9058,How to get a Magento product collection as a comma separated list of SKU's,magento
9059,Where is the best documentation of Microsoft Excel Biff format,excel
9060,Is it safe to put database file in htdocs?,apache
9062,How do I force Visual Studio to use an Open instance when double clicking a file?,visual-studio
9063,Drawing once per frame in Cocoa,cocoa
9064,Apache url rewrite problem,apache
9065,Hiding a DIV in sidebar in Wordpress,wordpress
9066,Problems while submitting a UTF-8 form textarea with JQuery/AJAX,ajax
9067,DateTime Hex Format,sharepoint
9068,JavaScript problem?,ajax
9069,Generating Fibonacci numbers in Haskell?,haskell
9070,Magento - create a fixed module,magento
9071,Last day of the month with a twist in SQLPLUS,oracle
9072,See binary instead of hex in Binary file while in a shell like bash.,bash
9074,NSBezierPath / Line Intersection / flatten,cocoa
9075,debugger warnings while viewing StackOverflow?,ajax
9076,"In WordPress, restrict number of posts a user can post in a day",wordpress
9078,ajax loading query in seperate div,ajax
9079,how to get the filepath when drag it from finder to a webview?,cocoa
9080,How do I create NSColor instances that exactly match those in a Photoshop UI mockup?,cocoa
9081,How to forbit subversion commits to svn:external to revisions?,svn
9083,"Oracle: what is the ""instantclient"" connection string format?",oracle
9084,How do I correct a Subversion project where I omitted trunk?,svn
9085,Should I keep solutions and features in a 1-1 ratio?,sharepoint
9086,"In cocoa, how can I darken everything displayed in a single NSView?",cocoa
9087,Real-time history export amongst bash terminal windows,bash
9088,Save all files in Visual Studio project as UTF-8,visual-studio
9089,Best way to post NSNotification with NSRect info?,cocoa
9090,Wordpress based website blocked by commercial proxy policies,wordpress
9091,Tool to help write Excel formulas and IF statements?,excel
9092,Display Ajax Loader while page rendering,ajax
9093,Need some Drupal best practive guidance.,drupal
9094,Find duplicate/repeated rows in hierarchical sql,oracle
9095,What is the equivalent of 'fread' from Matlab in Python?,matlab
9096,How can I get the icon for a storage device in Mac OS X?,cocoa
9098,Wrap stray text in <p> tags,wordpress
9100,What is the best way to implement syntax highlighting of source code in Cocoa?,cocoa
9101,Visual Studio: How to trigger an alarm when a breakpoint is hit?,visual-studio
9102,How can I sell a profile on magento?,magento
9103,Excel/VBA to check if a row exists,excel
9104,Wordpress is ignoring Unicode Chars in URL,wordpress
9105,Undefined symbols compiling apache module mod_transform on Mac OS X,apache
9107,"Oracle stored procedures, SYS_REFCURSOR and NHibernate",oracle
9108,Pattern matching characters for svn:ignore,svn
9111,QT set window background,qt
9112,Access to QTabBar instance,qt
9113,Auto-sync Visual Studio's Class View,visual-studio
9114,Drupal Custom Login by Role,drupal
9115,"How can I force my SharePoint AjaxSmartPart to use the smaller ""Release"" mode javascript?",sharepoint
9117,Wordpress - Create a splash screen without affecting search engine results,wordpress
9119,Qt QPlainTextEdit background,qt
9120,"Magento : call a variable from customer’s shipping address in Onepage checkout, step 3 shipping method",magento
9121,MATLAB help content for an abstract method,matlab
9122,Guidelines for applying DRY in Haskell function definitions,haskell
9123,Simple AJAX code not being recognized,ajax
9124,What plugin would you really like to have for Visual Studio 2005/2008,visual-studio
9125,Can Visual Studio 2010 Beta be installed side by side with VS2008?,visual-studio
9126,haskell: a data structure for storing ascending integers with a very fast lookup,haskell
9127,What is the single best resource for learning the visual studio tools?,visual-studio
9129,How should I store a Guid in Oracle,oracle
9131,Is there a tool for emailing Shelveset's and History items from within Visual Studio Team System?,visual-studio
9132,Matching multiple data type constructors at once,haskell
9134,SharePoint AValiablity,sharepoint
9135,magento admin usernames,magento
9136,Overridding a Shipping Method - What am I missing,magento
9137,Matlab postpones disp calls when doing demanding calculations why is that?,matlab
9139,Changing font tracking in Cocoa,cocoa
9140,Adding Zend Framework to php.ini include_path causes Drupal site to go blank,drupal
9141,How to get UTC value for SYSDATE on Oracle,oracle
9143,Controlling drop down lists in Windows SharePoint Services 3.0 Form,sharepoint
9144,How do you deal with configuration files in source control?,svn
9145,SharePoint error relating to page layout after creating site from template,sharepoint
9146,Core Data vs sqlite3,cocoa
9147,How to find and select multiple rows with macro (excel) ?,excel
9148,MaxValue Partition Name,oracle
9149,How do I convert a variable to a string?,haskell
9151,Matlab/octave count number of operations,matlab
9153,Magento get number of products for a price range,magento
9155,"Assume that WordPress is an almost-there CMS. What Plugins would you add to the 'core' to make it equal to ""Real"" CMSes?",wordpress
9156,Using nntool [MATLAB] from command line.,matlab
9158,How to force an order of cell evaluation on Excel,excel
9159,What to look for when downgrading from Oracle 10g to 9i?,oracle
9160,xml excel realtive path issue,excel
9162,QT4: Is it possible to make a QListView scroll smoothly?,qt
9163,Rendering Excel from browser,excel
9164,Line of best fit scatter plot,matlab
9166,Automatic .aspx Publising in SharePoint,sharepoint
9167,Confusion about currying and point free style in Haskell,haskell
9168,environment path loading incorrectly in bash,bash
9169,counting duplicates in a sorted sequence using command line tools,bash
9170,What is sql Loader...in details,oracle
9172,Cocoa - Suggested techniques for debugging binding problems between XCode and Interface Builder,cocoa
9173,Setting date cell format in excel xml,excel
9174,How Can I add additional functions to Visual Studio's Server Explorer?,visual-studio
9175,Excel: the Incredible Shrinking and Expanding Controls,excel
9176,Magento DataFlow Integration and Module Development Resources?,magento
9177,googlemap-like drag and zoom,ajax
9178,sort | uniq | xargs grep ... where lines contain spaces,bash
9179,Adding an extra column in the sharepoint list preview viewstyle,sharepoint
9180,AW Blog (Create Bookmarklet Feature),magento
9181,Reading directories in matlab,matlab
9182,NSPopUpButtonCell inside custom cell does not pop up when clicked.,cocoa
9183,What happens if I don't use the --Reintegrate option in Subversion 1.5?,svn
9184,Project (bin) folder path at compile time?,visual-studio
9185,How to quickly search a subversion repository?,svn
9186,How to filter out a set of strings A from a set of strings B using Bash,bash
9187,apache mod_proxy_html on Ubuntu ProxyHTMLEnable not working,apache
9188,Function fails on the second time i call it.,ajax
9190,magento 1.4 very slow on localhost,magento
9191,Drupal 6: onkeyup event to a custom form field,drupal
9193,Use Preferences menu item.,qt
9194,Use Apache behind Proxy,apache
9195,My trigger doesn't work in updatepanel?,ajax
9196,Looking for a web host that can handle Haskell,haskell
9197,show running processes in Oracle DB,oracle
9199,Events not firing/or observer not working in magento,magento
9200,"when close the top window ,how to let the focus to the next level window?",cocoa
9201,Client Side Templates in javascript how to bind data,ajax
9202,iPhone Dev: passing object from controller to a view,cocoa
9205,Docking Custom Task Panes,excel
9206,Custom Formatting before Save Wordpress,wordpress
9207,Altering the style of an NSSearchField.,cocoa
9208,Problem in migrating to LAMP from XAMPP.. Memory limit error,apache
9209,ajax architecture question,ajax
9210,Oracle 9i: Synonymed Table Does Not Exist?,oracle
9212,"sharepoint permissions issues - ""Access Denied""",sharepoint
9213,Explanation of “tying the knot”,haskell
9214,How to pass an array parameter in TOAD,oracle
9215,using the search box causes get_posts() malfunction,wordpress
9217,How to find the most dense regions in an image,matlab
9218,How do I compile an ASP.NET website into a single .DLL?,visual-studio
9219,Sharepoint SSL Web.Config access issue.,sharepoint
9220,Split a database of mol2 molecules into N smaller sets,bash
9221,Why isn't querying a JDBC-compliant database from Oracle as easy as pie?,oracle
9222,Structuring projects & dependencies of large winforms applications in C#,visual-studio
9225,Develop on local Oracle instance,oracle
9226,Getting WP Functions to Return rather than Printing Immediately,wordpress
9229,Ss it possible to use CIN and QT ???,qt
9230,In Visual Studio can i plot my variable in breakpoint ?,visual-studio
9231,C stack overflow on Project Euler Problem 27,haskell
9232,Do I lose change information with svn move --force?,svn
9235,Stripping images from post teasers/excerpts in Wordpress,wordpress
9237,How to get NSImage of generic folder icon on OS X 10.5 and 10.6,cocoa
9238,Get page content with theme structure in Wordpress,wordpress
9241,Oracle SYS_GUID does not change,oracle
9242,How do I rename a Project Folder from within Visual Studio?,visual-studio
9243,override save and load of an attribute in magento,magento
9244,Integrating Haskell in non-functional projects,haskell
9245,Inline editing with AJAX - how do I create multiple editable areas on the same page?,ajax
9246,display author URL in single,wordpress
9247,Can MOSS 2007 integrate with multiple LDAP/AD stores?,sharepoint
9248,Magento & vertnav extension,magento
9251,Listing Apache Derby Active Connections,apache
9252,How do I tell if a file does not exist in bash?,bash
