,text,label
3240,matlab - creating a single dimensional array from two dimensional parts,matlab
3241,Prefix form of unary operator in Haskell,haskell
3243,Pretty Print Excel Formulas?,excel
3244,Close all files in visual studio on exit,visual-studio
3245,Magento product listing using ajax,magento
3246,Need VB to make Excel calculate a sheet or range in realtime and in the background,excel
3247,magento - add links to footer but not to top navigational menu,magento
3248,How to migrate a 3rd party web part from SharePoint 2 (2003) to SharePoint 3 (2007),sharepoint
3250,how to get such results using excel formula,excel
3251,Are random numbers in Haskell strict?  Why does this program get a stack overflow?,haskell
3253,How to terminate a running process in matlab ?,matlab
3255,Moving to Subversion from SourceSafe,svn
3256,Find the differences between 2 excel worksheets?,excel
3257,Iterating unregistered add-ins (.xla) in Excel 2003,excel
3258,problem with Search module in drupal,drupal
3259,Identifier for win64 configuration in Qmake,qt
3260,How can I send a HTML email from Cocoa?,cocoa
3261,Custom Build Numbering in Visual Studio,visual-studio
3263,In Visual Studio (2008) is there a way to have a custom dependent file on another custom file?,visual-studio
3265,alternative to update_option() in wp-admin,wordpress
3266,"Haskel Hello world, exclipse IDE",haskell
3267,Should I add compiled DLLs to my subversion repository?,svn
3268,"svn import adds and commits a dir,but dir cant be browsed..",svn
3269,Getting Cabal to work with GHC 6.12.1,haskell
3270,Wordpress redirect on password to certain page,wordpress
3271,Programatically logging to the Sharepoint ULS,sharepoint
3272,generate excel sheet from a excel template in asp.net using vb.net,excel
3273,How is skill building for Sharepoint different from ASP.NET?,sharepoint
3274,Can this be done by sed?,bash
3275,Bash shell function error : command not found,bash
3278,Qt QIcon to load SVG files?,qt
3279,Qt signals and slots - are they intended for GUI only or for entire app architecture?,qt
3280,perl JOIN-like behavior in Oracle?,oracle
3281,What is the reason for NSFileManager's inconsistent use of NSURL?,cocoa
3282,Thousands of instances of index.php opening at the same time,wordpress
3283,Create an URI for an application,cocoa
3286,How do I get ALL posts in a category with Wordpress?,wordpress
3287,Migrating MOSS 2007 from SQL 2000 to SQL 2005,sharepoint
3289,SharePoint searching external database,sharepoint
3291,"start php, apache?",apache
3292,Wordpress: Editing pages with another editor.,wordpress
3293,Updating multiple DIVs via AJAX is inconsistent,ajax
3294,UNDOTBS Tablespace is Full what now?,oracle
3295,Sending SVN commits to an RSS feed,svn
3296,Sharepoint: How to find out whether an realtive URL is available or already used by a site,sharepoint
3297,Apache Perl http headers problem,apache
3298,Exception thrown in a referenced .dll how do I debug?,ajax
3299,Drupal: cck taxonomy field with depth filtering,drupal
3300,I want to create blog posts to drupal by sending messages through Outlook. Ideas??,drupal
3301,How do I learn to use SVN effectively?,svn
3302,How do I add per item personalisation options to the cart page of Magento?,magento
3303,Apache Django Mod_Wsgi Sessions Development Enviroment,apache
3304,"Why am I getting this error, when it cannot be true?",cocoa
3305,What's the fuss about Haskell?,haskell
3306,How do you configure Apache on Windows for SSL?,apache
3307,Learning Haskell: String manipulation question,haskell
3308,making graphs with a shell script,bash
3311,Array Formulas in Conditional Formatting of Excel XML Spreadsheet files?,excel
3313,Can I change the warning setings for Web Sites in visual studio?,visual-studio
3317,Magento - Email Shipment = Default,magento
3319,"Compressing HTTP request with LWP, Apache, and mod_deflate",apache
3320,Visual Studio hangs on build,visual-studio
3321,How to use Oracle jdbc driver fixedString property?,oracle
3322,AJAX - when user leaves page - good or bad practice/implementation?,ajax
3324,an axis is not showing up in Matlab,matlab
3325,getting variable values into a text string | MATLAB,matlab
3326,Apache and the c10k.,apache
3327,Scaling Drupal,drupal
3328,How do I convert NSString to NSData?,cocoa
3329,How does sharepoint recognize a file type?,sharepoint
3330,How safe is it to send a plain text password using AJAX?,ajax
3334,Qt auto software version?,qt
3335,Need Help with Magento Mini-Search,magento
3336,Detect matlab processes from within matlab,matlab
3337,installation HDBC-SQlite3 Haskell,haskell
3338,Excel DateAdd not working properly ?,excel
3339,AJAX page + SQL query behaving vaguely ?!,ajax
3341,System.Net.WebClient request gets 403 Forbidden but browsers do not with Apache servers,apache
3342,Where is the best place to put a DB query in drupal?,drupal
3344,What is your workflow for creating websites based on WordPress?,wordpress
3345,Drupal: include small form in page.tpl.php,drupal
3350,"stackoverflow ""Related Questions""",ajax
3351,Drupal - Set default value in hook_form_alter?,drupal
3353,What are some good resources on integrating web apps with SharePoint?,sharepoint
3354,What does a pipe in a class definition mean?,haskell
3355,Determining the port a Visual Studio Web App runs on,visual-studio
3356,404 Problem Running Visual Studio ASP.NET Unit Test,visual-studio
3357,DRUPAL: tags for CCK fields ?,drupal
3359,"Visual Studio Hosting Process and ""The operation could not be completed""",visual-studio
3361,"Qt, set background images loaded from disk",qt
3362,Limit Ammount Of Widgets In Wordpress,wordpress
3364,Interpolating 1D Gaussian into 2D Gaussian,matlab
3365,How can I overide a local module in Magento?,magento
3366,Understanding Drupal core?,drupal
3367,Internet Explorer 7 Ajax links only load once,ajax
3368,Magento Store - Remove Block using Update XML,magento
3370,apache plgin for NTLM for Getting  log in user name.,apache
3371,Problem connecting to SVN repository,svn
3372,Getting QMake to generate a proper .app,qt
3373,Build won't copy System.Drawing to output folder.,visual-studio
3375,indexing magento,magento
3376,Ordering Wordpress posts by most recent comment,wordpress
3377,Please recommand some book on Oracle and Apex,oracle
3378,Cross Platform C library for GUI Apps?,qt
3380,"How to get this bash script to work if the ""fileName"" contains space?",bash
3381,N-queens in Haskell without list traversal,haskell
3383,Qt: How to set QMenu to align to the right of a toolbar?,qt
3387,SSRS Report from Oracle DB - Use stored procedure,oracle
3388,Changing Design For All Module Pages In Magento,magento
3391,Create a tag upon every build of the application?,svn
3393,How can I customize the syntax highlighting in Visual Studio 2005?,visual-studio
3394,Matlab strcat function troubles with spaces,matlab
3395,Accessing SPWorkflowStatus from an SPListItem,sharepoint
3398,Excel problem with deleting CustomProperty in Korean,excel
3399,How to unit-test a file writing method with Visual Studio's built-in automated tests?,visual-studio
3400,How to play a mp3 file from within the Ressources folder of my application ?,cocoa
3401,Bash loop - tokenize on lines rather than words,bash
3402,How to access a matrix in a matlab struct's field from a mex function?,matlab
3404,"Apache Alias problem, Snow Leopard",apache
3406,"autoconf using sh, I need SHELL=BASH, how do I force autoconf to use bash?",bash
3407,Wordpress Widget auto activate,wordpress
3408,How to get Excel Integration in TFS to remember formatting?,excel
3409,Java/JAXB error in Matlab when using unmarshal function,matlab
3410,Center block element in element,wordpress
3411,Auto-redirect requests from /dirname to /dirname/,apache
3413,odp.net tracing,oracle
3414,Why must recursion be in a separate file in hugs?,haskell
3415,How to fix a misconfiguration with Phusion Passenger and a VirtualHost directive?,apache
3417,Combining Structures,matlab
3419,VS2008 setup project installing extra dependency files,visual-studio
3420,Reattaching to an orphan process in QT,qt
3421,Drupal - How can I use CCK to keep a local node copy of Aggregator items?,drupal
3422,Magento discount coupan code created on fly but not working properly.,magento
3423,Example of how to parse exiftool JSON output in Haskell,haskell
3424,Bazaar (bzr) integration with Visual Studio,visual-studio
3425,How do I use underscore in a wordpress permalink,wordpress
3426,Is there a built-in Haskell equivalent for C++'s std::bind2nd?,haskell
3428,"Magento - Buy X Get Y Free - Realistically, Buy one get one free BOGOF",magento
3429,"magento ""gender"" default option need change",magento
3432,"Using linux ""cut"" with stdin",bash
3433,Import files directly to SVN repo without checking out first,bash
3434,how to write a pl/sql code block that prints out contents of cursor that is out parameter from stored proc,oracle
3436,Wait for getJSON response,ajax
3437,Can a WordPress blog pull content from Django pages?,wordpress
3440,Fastest way to insert replacement characters in Visual Studio,visual-studio
3442,Countdown Timer in Cocoa,cocoa
3444,"In Cocoa/Interface Builder, how to clear text in textfield after button click",cocoa
3445,Is it possible to disable command input in the toolbar search box?,visual-studio
3446,Using .htaccess and mod_rewrite in a directory (not root),apache
3447,HTML Form/Database query,ajax
3448,Saving QList<T> to a file?,qt
3452,What to keep in mind when making Wordpress themes,wordpress
3453,"Display a menu with categories, sub-categories and products - Magento",magento
3454,Using an Alias in a WHERE clause,oracle
3455,Shell scripting: die on any error,bash
3457,Drupal OG Views: cannot create view of all groups of which I am *not* currently a member,drupal
3458,Where to place a query to show only one post in Wordpress,wordpress
3459,Qt: How to show icon when item selected,qt
3460,Haskell library like SymPy?,haskell
3462,What is the best way to make a QTableView's cells have up and down button pushed states in Qt?,qt
3464,Need help adding files to a subversion repository.,svn
3465,VS2010 Extensibility - how different is it?,visual-studio
3466,Solving drupal database entry dependancy problem?,drupal
3467,Trying to put an exception to RewriteRule in .htaccess,apache
3469,Asigning specific menu administration rights for roles in drupal,drupal
3470,Rails: submit (via AJAX) when drop-down option clicked,ajax
3471,htaccess redirect problem,apache
3473,XMLHttpRequest vs Socket vs ?,ajax
3474,Source install Apache 2.2.13 + PHP 5.3 + Snow Leopard,apache
3475,"Haskell, list of natural number",haskell
3477,SharePoint 2007 - Get Central Admin URL ID (guid),sharepoint
3478,How do I restore Apache and PHP to Leopard defaults?,apache
3479,go back to last state ajax pages?,ajax
3480,Migrating from other Content Management Systems to SharePoint,sharepoint
3481,Refactor to replace AjaxControlToolkit or RadAjaxManager,ajax
3483,Haskell: convert unicode integer to actual unicode character,haskell
3484,Stack overflow in OCaml and F# but not in Haskell,haskell
3485,Find string in httpxml.responseText,ajax
3486,How do you flip the coordinate system of an NSView?,cocoa
3488,Wordpress filter to modify final html output,wordpress
3491,Ajax Popup alert,ajax
3492,Newbie QT question about connect,qt
3494,QT Background Color,qt
3496,Drupal registration to create the new user account also in a 3rd-party system,drupal
3498,Microsoft Sharepoint,sharepoint
3500,Change the customer password field Magento,magento
3501,Operate on values within structurally similar types in Haskell,haskell
3502,Theming the default search results page in Drupal,drupal
3505,SVN - merge one branch into another?,svn
3506,Qt: Expand ~ to home-directory,qt
3507,drupal taxonomy term path to return alias,drupal
3508,Adding mini-login box in Magento,magento
3510,Haskell - Parsec Parsing <p> element,haskell
3511,Wordpress Post order,wordpress
3513,Not Ajax-related controls in AjaxControlToolkit?,ajax
3514,Errors creating WebPart subclass in another assembly,sharepoint
3515,Switch from file contents to STDIN in piped command? (Linux Shell),bash
3517,secure Oracle connection from java applet,oracle
3518,TSVNCache.exe is heating up my Mac,svn
3519,VS2005: Assembly '<assembly>' is incorrectly specified as a file.,visual-studio
3520,How to zip multiple lists in Haskell?,haskell
3521,Apache on WIndows - growing VM Size of httpd.exe,apache
3523,SVN plugins for Eclipse - Subclipse vs. Subversive,svn
3524,mspdbsrv.exe living forever?,visual-studio
3525,"How to call portions of Magento into an external CMS, such as ""item's in cart"" or a ""login form"" in 1.4.",magento
3527,Oracle Connection and nls_lang,oracle
3528,"Script puzzle <script src=""ajaxpage.php?emp_id=23"" /> ?",ajax
3529,Neural network XOR backpropagation info needed.,matlab
3530,Magento - Use Short description for Google base description,magento
3532,Show camera inputs at different axes - MATLAB,matlab
3533,"Is it recommended to always have exhaustive pattern matches in Haskell, even for ""impossible"" cases?",haskell
3535,Replace chars in file by index,bash
3536,Create Multiple 'Posts' lists in one SharePoint Web.,sharepoint
3538,Can't seem to use bash -c option with arguments after the -c option string,bash
3539,How do I embed a File Version in an MSI file with Visual Studio?,visual-studio
3540,What does IAlertNotifyHandler's OnNotification() return value do?,sharepoint
3541,Python to MATLAB: exporting list of strings using scipy.io,matlab
3542,SharePoint and deployment of global.asax code,sharepoint
3543,Matlab Polymorphism question,matlab
3544,Storing Array of Floats as a BLOB in Oracle,oracle
3545,"drupal, rules, flag, date",drupal
3546,ajax library that populates multiple fields,ajax
3548,update progress and it shows image while data is pulled from Database.  but need  to  block the  screen,ajax
3550,ASP.NET JavaScript Callbacks Without Full PostBacks?,ajax
3551,Visual Studio 2005 ERROR: An error occurred generating a bootstrapper: Invalid syntax.,visual-studio
3552,Close client connection preaturely with apache/mod_perl,apache
3554,Automatically execute an excel macro on a cell changed by a real-time add-in,excel
3556,When does selectedCell change?,cocoa
3557,Displaying static information in a Wordpress blog,wordpress
3558,Which delegate method I should use When I cliked on a textfield?,cocoa
3560,innerHTML size limit,ajax
3561,Is  SVNAutoversioning directive in apache subversion imporant?,apache
3562,Forcing Reading of a Text Field Before Dismissing Modal Dialog in Cocoa,cocoa
3564,Pattern matching for lambda expressions,haskell
3565,Naming convention of im2bw in MATLAB,matlab
3566,Sharepoint workflows does not start,sharepoint
3567,stereo in QT using Open GL,qt
3568,"In Magento, how can I organize products from different categories under a parent entity which in turn has it's own attributes?",magento
3569,How can I enable auto-updates in a Qt cross-platform app?,qt
3571,Commenting in BASH script,bash
3573,Browser continues 'loading' after ajax request finishes.,ajax
3574,"QT MySql connectivity using Windows XP, Qt Creator 4.5.2(windows 32 bit)",qt
3575,How do you combine filter conditions,haskell
3576,Cannot integrate custom widgets dll into Qt designer,qt
3577,How to automatically expand all children of an nsoutlineview in cocoa?,cocoa
3578,regular expression in haskell,haskell
3579,Magento - change address to which confirmation is sent after newsletter subscription,magento
3580,Top ten ordering in Excel based on complex team rules,excel
3581,"SVN workflow, LAMP",svn
3582,Magento 1.4 paypal bug,magento
3583,Drupal: updating with Drush doesn't change update status,drupal
3584,Oracle 10 optimizer from RULE to COST: why?,oracle
3587,Can NSAlert Be Used to Create a Floating Window?,cocoa
3588,"Already have MSDN with Team System Test edition, how do I....",visual-studio
3590,Configure Apache to use different Unix User Accounts (www-data) per Site.,apache
3591,Matlab - plot multiple data sets on a scatter plot,matlab
3592,How to get the token type from a CFStringTokenizer in Cocoa?,cocoa
3593,Should I add the Visual Studio .suo and .user files to source control,visual-studio
3594,How do I determine if the item is selected or not in the paint() function of QItemDelegate?,qt
3596,drupal multiple node forms on one page,drupal
3597,Modificate content profile form to show checkboxes in the matrix,drupal
3598,How to cut some text from string in bash?,bash
3600,"Ajax.Actionlink, how to get the form data to the controller action",ajax
3601,TOAD vs AquaFold - Connecting to Oracle,oracle
3603,How do you clear your MRU list in Visual Studio?,visual-studio
3604,Proper way to import things already defined in the Prelude in Haskell,haskell
3605,load the result of an egrep inside a editor (vim/emacs/gedit),bash
3606,WordPress sub domain htacess problem,wordpress
3608,How can I hook up to Excel events in Javascript,excel
3610,Adsense in a AJAX heavy webapp,ajax
3611,How update oracle heterogeneous services metadata?,oracle
3612,Wordpress Post # of #,wordpress
3613,Get current working directory name in Bash Script,bash
3614,Set parent's status bar text?,qt
3615,WP-Contact Form 7 -- PHP Question,wordpress
3616,Users not showing up in Sharepoint Audiences,sharepoint
3618,How to create new theme in drupal 7,drupal
3620,magento onepage checkout problem,magento
3621,Wordpress Rewrite Redirect Failure,apache
3625,TreePlot String Labeling MATLAB,matlab
3627,Is there a Drupal module for Forms with powerful CRUD style behaviour?,drupal
3630,Open a terminal window to a specified folder from a Cocoa app.,cocoa
3631,How to apply moving windows to a 2D matrix in MATLAB?,matlab
3633,how to populate dropdown with dynamic date based on 2 other dropdown boxes,ajax
3634,Excel dynamic tables like functionality in web application,excel
3635,"How to put Apache website to 503 ""temporary down""?",apache
3636,Where is the 'Autos' view in msdev 2005 ?,visual-studio
3638,Is there a convention for naming 'private functions' in bash?,bash
3640,"On OS X, seperating a GUI into multiple NIB files and NSView subclasses",cocoa
3642,Cocoa NSDocument: getting autosave to work,cocoa
3645,Bash output as Applescript list problems.,bash
3646,IIS equivalent of VirtualHost in Apache,apache
3647,Customizing Magento Sidebar,magento
3648,How do I install nano-hmac on Mac OS X?,haskell
3649,Qt or Delphi... If you were to choose one over the other?,qt
3651,SVN (mod_dav) 403 FORBIDDEN OPTION request,apache
3652,Reference and filter data to other sheet in Excel,excel
3654,"Ajax Asynchronous in IE - Error ""The Data Necessary to Complete This Operation is Not Yet Available""",ajax
3655,another simple Haskell question,haskell
3656,Inheriting std::istream or equivalent,qt
3657,Editing SQL query with Visual Studio 2008,visual-studio
3658,How can I automate the process of deploying an InfoPath Form to SharePoint Server 2007?,sharepoint
3659,Limit a double to two decimal places,cocoa
3660,Color part of graph under a line in Matlab,matlab
3661,What are the steps to creating an 'executable bundle',cocoa
3662,How to retrieve the first word of the output of a command in bash?,bash
3663,What leads to a no suitable image found error on Mac OS X?,cocoa
3664,Matlab Magical Mystery timing behavior,matlab
3665,sharing mysql conntection between php files,ajax
3667,How to convert m-files to dlls?,matlab
3668,Can I use a wordpress theme in new php pages?,wordpress
3669,Choosing a desktop database,oracle
3670,Weird problem using custom fields,wordpress
3672,QTCreator's integrated form editor won't load custom widget plugins (Designer does),qt
3674,"NSLog on Mac OSX/iPhone, usage of the '#' key?",cocoa
3675,How do I set a surf to one color (no gradient) in my matlab-plot?,matlab
3676,"On Cygwin, how do I install curl from hackage?",haskell
3677,What is the algorithm to covert an Excel Column Letter into its Number?,excel
3678,Switch from SVN to GIT for C# developments?,svn
3679,Looking for an alternative matlab editor.,matlab
3680,Plotting in Matlab,matlab
3681,Bash Script on a Mac creates a info popup,bash
3682,How to make file show when opening Visual Studio solution,visual-studio
3683,how to deploy web.config modifications in a Sharepoint web application?,sharepoint
3684,Magento and country codes for table rates,magento
3685,QTableView - what signal is send when user selects a row by clicking to it?,qt
3686,Finding index of element in a list in Haskell,haskell
3687,Cocoa -/+ declarations,cocoa
3688,Is there a way to return 404 Not Found for prohibited directory listings in Apache?,apache
3690,choosing rows form a file,bash
3691,Any way to keep myself from accidentally building in the wrong Visual Studio configuration?,visual-studio
3692,"magento 1.4, why does a configurable product have a sku",magento
3693,Codeplex SVN $Author$ Property problem,svn
3696,Displaying WebCam video with Qt,qt
3697,Drupal: Views Grouping Issue,drupal
3701,is it possible to migrate a single component from one svn repository to another while preserving history?,svn
3702,Problem with QSqlTableModel -- no automatic updates.,qt
3703,SharePoint does not find my custom RenderingTemplate,sharepoint
3704,Drupal: Access $profile from a block,drupal
3705,Does Visual Studio have debug symbols available?,visual-studio
3707,Set screen-title from shellscript,bash
3708,How to remove a cookie using mod_rewrite,apache
3709,Building multiple targets in Qt / Qmake,qt
3711,RA-AJAX download anywhere?,ajax
3712,Theme a CCK input form in Drupal 6,drupal
3713,Escape < and > in sed/bash,bash
3714,Calendar + Events in Drupal 5,drupal
3720,Excel automation. Need to multiple items from a Range,excel
3721,How to put BIDS solutions under source control?,visual-studio
3722,How do I do automatic data serialization of data objects in Haskell,haskell
3723,Apache/PHP closes connection after short time (12 secs),apache
3724,Best way to license Microsoft software as a very small developer,visual-studio
3725,MVC with SharePoint,sharepoint
3726,Abstract class memory management in Cocoa,cocoa
3727,How do I get my fortran output into excel?,excel
3728,Preserve ls colouring after grep'ing,bash
3729,Garbage Collection Crash using NSImage,cocoa
3731,Ajax: Building HTML vs injecting HTML,ajax
3732,Parse the HTTP_COOKIES string from Apache for use in #if clause,apache
3733,Bash - Passing arguments by reference,bash
3734,Returning Json data from Orchard Controller using Jquery Ajax,ajax
3735,"Visual Studio 2008 ""randomly"" hangs on test run",visual-studio
3736,Revovering from Subversion corruption,svn
3738,Drupal CCK: how to output a node teaser with its fields?,drupal
3740,Escaping out of the Find and Replace box in Visual Studio 2008,visual-studio
3741,Using Magento with a simple one-product site,magento
3744,How to disable XML DTD validation in Oracle DB?,oracle
3746,"NSTableView, multiple cells and bindings",cocoa
3749,Copy method fail due to memory,excel
3750,Import Date Format mmddyyyy,oracle
3751,Qt moc_ include file problem,qt
3752,SharePoint web services: test if file exists,sharepoint
3753,how to find remaining nodes in following code which are not participating in making edges with each other?,matlab
3754,How to implement a AJAX function in PHP ?,ajax
3755,Breaking a cell if it contains a newline character,excel
3757,"Matlab ""out of memory"" error",matlab
3759,Problems with the PHP script to generate the licenses in Aquatic Prime,cocoa
3760,"Drupal: module, cck or other",drupal
3761,How to link Qt to and already existing MinGW installation?,qt
3764,Is there a way to conditionally run Visual Studio Post Build Steps,visual-studio
3765,How do I connect to a remote svn server?,svn
3767,Sharepoint Web Services Tutorial,sharepoint
3768,How to update QCompeter's model dynamically,qt
3769,Excel VBA Macro: Check content (of clipboard?) before pasting,excel
3770,SharePoint setup best practices with ISA,sharepoint
3771,Y-Combinator in FT EDSL,haskell
3772,in-house projects: to stable release or not?,svn
3773,Using Magento 1.4's WYSIWYG editor on custom admin pages,magento
3775,"Tripping over NSValue, NSNumber & NSDecimalNumber",cocoa
3776,What's an OCCI context and environment?,oracle
3777,How to set an alias inside a bash shell script,bash
3778,What PHP framework to choose for a Senior Project,drupal
3779,Raise ParseError in Haskell/Parsec,haskell
3780,Comparing wildcards for equality in Haskell..?,haskell
3781,NSString to wchar_t*?,cocoa
3782,What is the default URL for APEX for an Oracle XE installation?,oracle
3784,Hierarchical Wordpress page nav with all permalinks in the root,wordpress
3785,xls to text converter,excel
3787,SharePoint Search on default Masterpage,sharepoint
3789,Is it possible to convert projects wizard created for MSVS 2005 to MSVS 2008 format autom,visual-studio
3790,Can you install Qt-4.6.0-wince successfully?,qt
3791,pipe many outputs to same file at the same time?,bash
3792,Magento 1.4 extension development,magento
3794,Focusing on a tabified QDockWidget in PyQt,qt
3795,Search Box in QToolbar,qt
3796,Haskell Tuple Size Limit,haskell
3797,Objective-C networking - best practices?,cocoa
3800,"Drupal shared tables, but from another database",drupal
3801,Best Matlab toolbox that implements Support Vector Regression?,matlab
3802,Apache mod_rewrite - rewriting from subdomain to main domain,apache
3803,price filter problem in magento,magento
3804,How to Search a value in an Excel from .net application?,excel
3805,How do you stop SVN Checkout from bringing back files that were deleted from the project?,svn
3806,Magento: The best way to hook into the checkout process,magento
3807,sort categories according to date when its added,magento
3808,image processing toolbox in matlab,matlab
3809,How to configure Apache to proxy exactly one file?,apache
3810,WordPress front page (homepage) fails to redirect when static front page is set.,wordpress
