,text,label
1,Use Oracle 6 from ASP.NET application,oracle
4,Weird bindings issue,cocoa
6,test sending emails from SharePoint without smtp server,sharepoint
7,cell and array in Matlab,matlab
8,How do I call an ORACLE function from OCI ?,oracle
9,Typed FP: Tuple Arguments and Curriable Arguments,haskell
10,Do I still need to learn about managing memory now that Objective-C/Cocoa has Garbage collection?,cocoa
11,"Wordpress: wpdb->insert VERSUS wpdb->prepare(wpdb->query(""INSERT...",wordpress
13,Magento - Display Same Block Multiple Times on CMS Page,magento
14,How to tell SVN to ignore files for all team members,svn
15,How do I switch external css files with ajax?,ajax
16,Magento - Code Question,magento
18,Handling metacharacters in search strings,bash
19,magento example module,magento
20,Sql server Newbie needs help,excel
23,"How to get a Wordpress widget to ""remember"" values.",wordpress
24,Cabal and zlib on OS X,haskell
25,How do I watch a serial port with QSocketNotifier (linux)?,qt
26,Controlling the order of QObject children (possible workaround?),qt
27,Inserting into Oracle the wrong way - how to deal with it?,oracle
28,Bash: Delete until a specific file,bash
30,Undelete in SVN working copy,svn
31,how to add additional message in a Drupal form,drupal
32,NSColor with calibrated values works differently than regular color??,cocoa
33,How do you rate Oracle Portals as a platform?,oracle
34,Executing simple commands with Cocoa and Sdef.,cocoa
35,Little Bash Script: Catch Errors?,bash
36,Undeletable file due to backup script,bash
37,"Creating ""pretty"" Qt Custom Widgets",qt
39,Floating Point Comparison in Shell Script,bash
40,Is there any way to only update added files?,svn
41,Cleaning up nested mod_rewrite statements,apache
43,How to debug the main SafariPlugIn project ?,cocoa
44,How to create a tray icon with custom image using QT?,qt
45,magento simple product link to open grouped products page,magento
48,How do I test if a floating point number is an integer in haskell?,haskell
49,Tips for using CVS or Subversion as a backup framework for office documents,svn
50,"Per-filetype ""View whitespace"" setting in Visual Studio",visual-studio
51,How to show x and y axes in Matlab graph?,matlab
52,How to gain access to all  open windows on Desktop using Cocoa?,cocoa
53,Drupal automatic glossary for specific terms,drupal
54,Show product creation & last edit dates on Frontend in Magento,magento
55,Make Apache wait longer before delivering HTTP 408 request timeout,apache
56,How to automate Matlab/Simulink/Real-TimeWorkshop  code generation?,matlab
57,QT: Hide the title bar of a dialog/window,qt
58,Query to Delete Posts Older than X Days in WordPress,wordpress
60,"SharePoint Lists, GetListItems, XML, and VBA - I just want to crossreference!",sharepoint
61,What is GHCi's default implementation of MonadError?,haskell
62,Changing a user created control based on content of input from JS tied textbox,ajax
63,Apache returns sitemap.xml not /sitemap,apache
64,QT question about a QList<QStingList>,qt
65,"safe, fast CFLAGS for mex functions in matlab",matlab
66,Firing a SharePoint Workflow by updating a list item through List Webservice,sharepoint
68,Run Magento in the future!,magento
70,Response.redirect does not work with Ajax controls,ajax
71,Notify upon background jobs finishing running in bash,bash
73,Apache logs -- what is difference between %a and %h?,apache
74,Running A Bash Script Over SSH,bash
76,Using CMS to make webapps.,wordpress
77,QTMovie Notification,qt
81,add column to wordpress database,wordpress
82,Unpacking varargin to individual variables,matlab
83,Drupal / Rules: flagging multiple terms on user save,drupal
84,Excel: parse text as formula,excel
85,Why does this Haskell code work successfully with infinite lists?,haskell
87,Drupal module for webmaster block management?,drupal
91,Thread safety of Matlab engine API,matlab
92,AJAX and callback function,ajax
94,Where does Drupal store NODE data?,drupal
95,MetaStorm Ework and SharePoint 2007,sharepoint
97,Best SVN Tools,svn
98,Qt +hiding window after startup,qt
99,SQL-WHERE TYPE Formulas in Excel,excel
100,Why does Spotlight sometimes not run my query?,cocoa
101,How do I sort my code in Visual Studio 2008?,visual-studio
102,Hiding a SharePoint Custom Field Type in Edit and Create mode,sharepoint
103,Improve oracle query performance without indexing,oracle
104,Get all pixel coordinates of a vector inside a image,matlab
105,$$ in Bash.,bash
106,Creating a bundle - What's going wrong?,cocoa
107,static site apache and dynamic/member site django,apache
108,Qt 4.5.3 QEvent::EnterEditFocus,qt
110,Detecting the number of ORACLE rows updated by a OCI OCIStmtExecute call,oracle
111,"Using mod_rails to host multiple apps under SSL, same domain",apache
112,What's the best way to examine apache's access.log files?,apache
113,How can I remove missing files with spaces in svn?,bash
114,Howto get SharePoint version using object model,sharepoint
115,Excel: Formula to reference an entire pivot table?,excel
116,Can a Bash script tell what directory it's in?,bash
117,Oracle: What does `(+)` do in a WHERE clause?,oracle
118,svn + repostiory location,svn
119,Wordpress Add Links,wordpress
120,How to make a sub string selection and concatenation in excel ?,excel
121,Apache / htaccess rewrite - From domain to subdomain,apache
122,I need to order a list that is dependant on another list. how to change both lists?,matlab
123,"Drupal node_save no longer returns $nid, so how do I get it?",drupal
124,How do i make my colleagues not despising SVN?,svn
126,fatal error Varien_Autoload not found,magento
127,Communicate to Apache Server,apache
128,Wordpress: query all images in a posts media library,wordpress
129,Read excel sheet in c#.net,excel
130,BASH: Test whether string is valid as an integer?,bash
131,How to implement such an effect using matlab?,matlab
132,Sharepoint - Providing data outisde intranet,sharepoint
133,how to shear image in matlab without using built in function?,matlab
134,Magento - Add CMS Block to One Page,magento
135,ajax success event not working,ajax
136,Tracking down errors in Haskell,haskell
138,MATLAB arbitrary code execution,matlab
139,"""Microsoft Visual C# IntelliSense has stopped working"" in project referencing F#",visual-studio
140,Wordpress SEO Features,wordpress
141,Unsolvable Magento Cart problem,magento
142,Wordpress: How do I convert a generated URL (permalink) to a pretty URL?,wordpress
143,Visual Studio plug-in that mimics eclipse environment,visual-studio
144,Is it possible to aggregate information from portal list to My Site,sharepoint
145,Managing Browser History in Ajax,ajax
146,How do you output a line break in the command view in Matlab when running a m-file?,matlab
148,Drupal workflow action access integrated with taxonomy access control?,drupal
149,How to set selected filter on QFileDialog?,qt
150,VisualStudio: How to save the obj folder somewhere else,visual-studio
151,"Using Data.Heap in Haskell, or reading Haskell docs for a beginner",haskell
154,Write a Haskell interpreter in Haskell,haskell
155,can not get scion_server to be created using runghc,haskell
159,Tracking permissions in SharePoint,sharepoint
160,Searching views in Drupal,drupal
161,Hidden features of Qt.,qt
162,mod_rewrite depends on what other modules?,apache
163,trouble connecting Excel to Analysis Services server..,excel
164,Problem with IE8 using AJAX,ajax
166,How do I find how much SVN traffic I'm using?,svn
167,How to extract leaf nodes from Oracle XMLTYPE,oracle
168,"Cocoa Distributed Objects, Long Polling, lunchd and ""Not Responding"" in Activity Monitor",cocoa
169,Looping over commands to print and execute in BASH,bash
170,I want my wp 2.8.6 blog to be seen as written in Spanish by Feedburner.,wordpress
171,how do i add a view to schema.xml in sharepoint,sharepoint
172,drupal search on the top taxnomy term,drupal
173,Drupal Photo Gallery Tutorial,drupal
177,Best Way to ReUse Code When Using Visual Studio?,visual-studio
179,Extended maxima transform in Matlab,matlab
180,What to do with “Inferred type is less polymorphic than expected”?,haskell
181,Setting error log filename in apache to include current date,apache
182,Apache FOP: Displaying UTF-8 Characters in PDF (without embed?),apache
183,Restrict access using SSL certs,apache
184,jquery tab gives 404 sometimes when loading remote content,ajax
187,Format cell color based on value in another sheet and cell,excel
188,how to update a file in svn?,svn
191,Trouble with Float in Objective-c,cocoa
193,How to ensure AJAX encoding will work,ajax
194,Multiple views and source list in a Core Data app,cocoa
195,CruiseControl.net : Using SvnLabeller / SvnRevisionLabeller,svn
196,Dimension Reduction,matlab
197,Reading/writing QObjects,qt
198,How to change category page layout in magento,magento
199,Corrupted Qt Widgets on Windows Mobile,qt
201,How do I sort a file in place using bash shell?,bash
202,Extract filename and path from URL in bash script,bash
203,Fastest way to import CSV files in MATLAB,matlab
204,Using Win32 API in Qt OSE project,qt
205,Drupal: How to format email message using node invite module?,drupal
206,custom shipping in magento,magento
207,spike in my inverse fourier transform.,matlab
210,Magento Installation Problem,magento
211,What's the best way to create a drop-down list in a Windows application using Visual Basic?,visual-studio
212,QtPython: removeChild/addChild QGroupBox,qt
213,Translate a Field's Label in a Drupal Content Type,drupal
215,"How can I make the ""find"" Command on OS X default to the current directory?",bash
216,PHP wordpress style related posts,wordpress
220,Deploy Qt+Boost application on a Mac and Windows.,qt
222,How to create a series of dates in Cocoa for a week,cocoa
223,Oracle - ODBC connection using MS Access error (ORA-12154),oracle
224,Visual Studio 2010 SP1 to 11 Beta - Unit Test Project Cannot be Loaded,visual-studio
225,What Confuses you about Magento Widgets?,magento
227,How do you solve this Haskell problem?,haskell
228,Bash scripting problem,bash
229,What are uses of polymorphic kinds?,haskell
232,Visual Stuido: Make view code default,visual-studio
233,SVN - Retrieving Useful Information,svn
234,How to split a file and keep the first line in each of the pieces?,bash
235,"Error: Attempted to access data(2,:); index out of bounds because size(data)=[1,7129].",matlab
237,Texture mapping in MATLAB,matlab
238,Can Visual Studio be made to debug child processes like WinDBG?,visual-studio
239,Wordpress Roles > Allow Editors to Edit Themes?,wordpress
240,How can you work out the ID of a users MySite,sharepoint
241,Making Excel 2002 use .NET v2.0.50727 runtime,excel
242,How would you recommend adding an image as a custom field in WordPress?,wordpress
243,how to click a text with underline for showing a web?,cocoa
244,"VS2008 crashes with ""Fatal Execution Engine Error""",visual-studio
245,matlab precision determint problem,matlab
247,Error: <target>.ColumnName and <source>.ColumnName have conflicting properties: DataType property mismatch.,excel
249,Matlab: How to get the current mouse position on a click by using callbacks,matlab
251,Turn off auto formatting in Visual Studio,visual-studio
252,Matlab - divide matrix elements by column sums.,matlab
253,Drupal: Which MySQL do I need?,drupal
254,Custom comment form in CCK template,drupal
255,How do I tell Apache which PHP to use?,apache
257,How do I remove CSS from WordPress admin sections,wordpress
258,Need a little bit of help with text alignment in wordpress,wordpress
259,Sharepoint: Deploy Custom Lists and New Columns in lists,sharepoint
260,Is Haskell really a purely functional language?,haskell
262,cd doesn't work when redirecting output?,bash
263,What's the equivalent of Oracle's to_char in AS400 DB2 SQL syntax?,oracle
266,Storing a passwords in NSString without being readable in memory,cocoa
267,Sharepoint - Permissions?,sharepoint
268,"Wordpress, WP_Query with custom taxonomy and custom post type",wordpress
269,Change owner on publish node in Drupal,drupal
271,Visual studio or resharper shortcut to close currently selected file in IDE,visual-studio
272,Manupulating Excel files from Windows Scripting Host,excel
273,Sharepoint workflow problem,sharepoint
274,Ajax Javascript show/hide works with JQuery 1.3.2 but not JQuery 1.4,ajax
276,can you asyncronously notify a web browser?,ajax
277,Reading images from file in MATLAB,matlab
278,Invoking Wine From Apache,apache
279,Customize the way CCK Node Reference fields are displayed in Drupal,drupal
280,Displaying translucent / irregular-shaped windows with Qt,qt
283,Singleton Design,cocoa
284,problem with Double and Rational Number,haskell
286,Display Posts from a category in Wordpress?,wordpress
287,Apache resource usage,apache
288,retrive the text in a specific cell in a QTableWidget?,qt
289,"How does Apple make the info.plist display its ""Information Property List""?",cocoa
290,changing search-dirs for $ sudo gcc,haskell
292,How to convert Excel sheet column names into numbers?,excel
293,Excel Overtime Calculation,excel
294,Export to Excel from a Repeater?,excel
297,How to check for empty array in vba macro,excel
298,MATLAB: what's the most elegant way to delete known element in matrix?,matlab
299,How to categorize Google Docs published as posts to Wordpress,wordpress
301,Bash arrays: Need help with white space,bash
303,Resizing Mfc dialog with embeded QWinWidget,qt
304,List of existentially quantified values in Haskell,haskell
307,Is it necessary for Qt::paintEvent to be reentrant?,qt
308,Wordpress - automatically creating page,wordpress
309,Oracle: OALL8 is in an inconsistent state,oracle
310,What is the shorcut in visual studio to switch from code behind to Xaml Code ?,visual-studio
311,Visual Studio - Prevent stopping debugging from closing Internet Explorer,visual-studio
313,How do I update the matlab path?,matlab
314,Why does Haskell interpret my Num type as an Enum?,haskell
315,How can I get rid of dynamic SQL,oracle
316,Excel reading in ASP.NET : Data not being read if column has different data formats,excel
317,A View Controller that can be instantiated both programatically and in IB?,cocoa
319,finding apache build options,apache
320,PL-SQL: getting column data types out of query results,oracle
321,Merge and Left Justify a Range of Rows in Excel,excel
322,"how to express {2n+3m+1|n,m∈N} in list comprehension form? ( N is the set of natraul number including 0)",haskell
324,Read Excel File Data From HttpPostedFileBase object,excel
325,"In Magento Layered Navigation, how do I get all items for active filters?",magento
326,including Qt headers in DLL,qt
327,Sharepoint ItemStyle.xsl for CQWP using images from a content type,sharepoint
328,What changes do I need to make Magento work with PHP 5.3?,magento
329,Basic AJAX example with ASP.NET MVC?,ajax
331,Highlight colors in an NSTableColumn on highlight,cocoa
332,Cocoa Check for Updates,cocoa
333,Is there a Visual Studio shortcut for replacing the beginning and ending tag name in XAML/XML/HTML at once?,visual-studio
334,Do I understand Ajax correctly?,ajax
335,line of bash code from .configure file,bash
336,How to setup non-admin development in Visual Studio 2005 and 2003,visual-studio
337,"wordpress: actions, filters & hooks",wordpress
338,Passing a string with spaces as a function argument in bash,bash
339,How do I generate an SSL Certificate with Microsoft Certificate Services and then install / configure it to work with Apache?,apache
341,Can you print JavaScript variables from a Visual Studio 2008 Tracepoint?,visual-studio
342,Oracle SQL technique to avoid filling trans log,oracle
343,Setting a default Apache RewriteRule entry,apache
344,Apache Rewrite does not redirect,apache
345,Sharepoint Blog: enable/disable comments regarding field value of Posts,sharepoint
346,Magento - blank lines being added to wsdl file,magento
347,Magento backend problem,magento
348,Unable to open the Web site: http://.. Forbidden,visual-studio
349,Problem installing haskel-platform,haskell
350,numericupdown control,visual-studio
354,Best setup for code promotion and feature branching in Subversion?,svn
356,Visual Studio vs. #Develop - Default event handlers,visual-studio
357,Tools for matching name/address data,oracle
358,a sufficant way to show logs in a graphical interface using whiptail bash,bash
361,Creating object named after the value of an NSString - is it possible?,cocoa
362,How to read Excel file in c# by connection string?,excel
364,new page in backend in  magento,magento
365,Subversion update externals to a date,svn
366,a link to parent node in nodecomments in drupal 6,drupal
368,Invoice for 2 or more orders in magento,magento
369,Moving advanced search - Magento,magento
370,File Watcher in Cocoa,cocoa
371,Have you integrated Mantis and Subversion?,svn
372,How do you change the look of a check box?,cocoa
374,[Matlab] Saved EPS image different than plotted chart,matlab
375,Invoking drupal,drupal
376,newly installed apache serving html content as text,apache
377,SVN backup,svn
378,"Subversion ignoring ""--password"" and ""--username"" options",svn
379,"Why does my web part throw an error about ""NT Authority/Anonymous User""?",sharepoint
380,"Bash: Copy a folder full of files and folders to an external hdd, but only if there is enough space to complete the copy.",bash
381,How to put more than 1000 values into an Oracle IN clause,oracle
382,Are there tools that would be suitable for maintaining a changelog for a Cabal Haskell package?,haskell
383,Merge contents of 2 Excel cells keeping character format intact (using VBA),excel
385,What's XLSHTML?,excel
386,QMutex stuck in locked state,qt
387,How can i open popup window in magento admin panel?,magento
388,Ajax autocomplete (or autosuggest) with TAB completion similar to shell command line completion?,ajax
389,Tool to automatically reformat whole C# source tree in VS2008?,visual-studio
391,Google Adwords conversion on form submission in Drupal,drupal
393,How do I create a custom wordpress page?,wordpress
394,Best Way to Ajax-Control Table Rows,ajax
395,Is it possible to bind the null placeholder in Cocoa?,cocoa
396,Implementing Tiny MCE As Local HTML Editor,apache
398,Defining a seemingly simple Foldable instance,haskell
399,VS2008 debugging with firefox as default browser - how to make the debugger stop/close on exit?,visual-studio
400,"Creating a ""Breaking News"" div with ajax if file exists?",ajax
404,Print certain tabs,excel
406,What's the best way to compare two sheets in an Excel workbook,excel
408,Is there an encyclopedia/list of common type classes in Haskell?,haskell
411,Do you continue development in a branch or in the trunk?,svn
412,Split ByteString on a ByteString (instead of a Word8 or Char),haskell
413,How to I authenticate with a ISA proxy from my application seemlessly?,qt
415,A general linux rights question: Apache and WordPress,apache
416,C framework like Qt ?,qt
417,Improve my Haskell implementation of Filter,haskell
420,How to set Wordpress and index.php to WP site,wordpress
421,Using Node Data after Node is Created,drupal
422,Haskell mutable map/tree,haskell
423,Stop a custom submit button from firing the form validation on a CCK form,drupal
424,Running subversion under apache,svn
425,Capturing a Map to embed in a Wordpress Blog post,wordpress
426,Visual Studio - Publish to multiple locations?,visual-studio
427,Embedded JPG resources not loading in Qt application,qt
429,"definition of filter function with foldr, in haskell. i want to see if i understand how it's working.",haskell
430,How to change tinyMCE editor's button's default tag output in wordpress?,wordpress
431,How can you dynamically load Javascript functions using Ajax?,ajax
434,Subversion Tagging and Security,svn
435,Testing for a valid date in a oracle procedure's parameter,oracle
437,Oracle Analytics inside Cursor,oracle
438,How can I pass a complete argument list in bash while keeping mulitword arguments together?,bash
439,Bash One Liner: copy template_*.txt to foo_*.txt?,bash
441,QByteArray to integer,qt
442,password recovery for drupal,drupal
443,Intermediate lists in Haskell,haskell
444,'Array of arrays' in matlab?,matlab
445,Moving  MS Excel data to a website via a web service.,excel
446,PCI compliance issues for Magento running on Bluehost,magento
447,How can I associate many existing files with drupal filefield?,drupal
448,Internal linking in Wordpress...,wordpress
450,Oracle Pl/SQL: Loop through XMLTYPE  nodes,oracle
451,How to translate product name and info in Magento,magento
454,"How to get and display post's ""position"" in the query?",wordpress
455,Connect Visual Studio 2008 to Virtual PC 2007,visual-studio
457,substituting an Excel worksheet for an Access database,excel
460,Sharepoint Lists.asmx: The request failed with an empty response.,sharepoint
461,(less ugly way to) slice an array in bash,bash
464,Gridlines in excel through interop,excel
466,Oracle Forms/Applications in Internet Explorer 8 using JInitator,oracle
467,SVN Weirdness: Is It Possible It's Not My Fault,svn
470,"Implementing ""scrubby sliders"" in Cocoa?",cocoa
471,Multi-threaded BASH programming - generalized method?,bash
472,Using Alias in Apache ONLY if local directory not present?,apache
473,What access does Apache 2.0 need in Windows Server 2003 in order to start as a service?,apache
474,WordPress url error on IIS 7,wordpress
476,how to send an object from one js file to another js file ?,ajax
477,adding oracle's timestamp to query results,oracle
478,"Question about [[]], [] and $#",bash
479,A useful example of when to use vsize function instead of length function in Oracle?,oracle
481,Unable to enable jquery UI module in drupal??,drupal
483,How would you make a text cell in a an Outline View show how many children the parent row has?,cocoa
484,Ajax: Load XML from different domain?,ajax
485,Oracle empty strings,oracle
486,New folders are not uploaded in SVN,svn
487,How to serve files in Drupal without using links?,drupal
488,Best way to make NSRunLoop wait for a flag to be set?,cocoa
489,Magento API: Assigning preexisting simple products to configurable products,magento
490,Haskell numeric type heirarch in SICP exercises,haskell
491,wp_list_categories does not show current category,wordpress
492,setTimeout not working in javascript,ajax
493,Fill array with consecutive integers,excel
494,How do I configure visual studio to use the code view as the default view for Webservices?,visual-studio
496,tortoise svn in system tray possible?,svn
497,Bash egrep numbers not working in case,bash
498,How do I find the high water mark (for sessions) on Oracle 9i,oracle
502,"In QT, for a context menu item, how to hide the space of the icon",qt
503,Apache mod_deflate based on url parameters,apache
504,shared library locations for matlab mex files:,matlab
505,Haskell - How to best to represent a programming language's grammar?,haskell
506,How to use Subversion for non-compiled language?,svn
507,Cocoa screen capturing?,cocoa
508,SVN Manager App for Mac (better than XCode),svn
509,Is it possible to sort numbers in a QTreeWidget colum??,qt
510,Looking for recommendations on a good bash tutorial,bash
511,Magento - get list of items from orders for specific date range,magento
512,How to clear persistent variables while keeping breakpoints in MATLAB?,matlab
513,Understanding Haskell's filter,haskell
514,Using Visual Studio 2005 with ClearCase Eclipsed Files,visual-studio
516,"With wordpress, is there a statement like current_user_can except show something if a user does not have specific access?",wordpress
517,Not able to check if user is logged in magento system in footer.phtml file on some pages,magento
519,yslow still not giving me an A for expires header in apache httpd even though I added them,apache
520,Is there ANY way to suppress the browser's login prompt on 401 response when using XmlHttpRequest,ajax
521,Java Swing or Java Qt?,qt
522,Preserving data integrity in Drupal:,drupal
523,Help with Magento Custom Module. Redirect to another module and return to checkout,magento
524,QT: reject() closing whole app? Why?,qt
525,Visual basic auto imports namespaces,visual-studio
527,Haskell Type error,haskell
528,redirecting standard output to the calling process,bash
529,How to cancel ajax request that has run (on server side),ajax
530,How do I keep Resharper Files out of SVN?,visual-studio
531,Capture Qt widget as an image file,qt
532,"MFC ""Warning: skipping non-radio button in group.""",visual-studio
534,annotation() and text() in Matlab,matlab
535,How can grep interpret literally a string that contains an asterisk and is fed to grep through a variable?,bash
536,Creating Drupal taxonomy terms from code?,drupal
537,WordPress Child Theme,wordpress
539,How to wrapp an Oracle stored procedure in a function that gets executed by a standard SELECT query?,oracle
541,Apache Tomcat 6 Problem Not Found(404),apache
542,Excel form hides behind other windows after I browse for file but I want it to stay on top.,excel
544,'XMLHTTPRequest is Undefined' IE6,ajax
545,ListTemplateOwner,sharepoint
547,What is the best way of retrieving a specific post in Wordpress?,wordpress
548,Evaluating parsed expression in Haskell,haskell
549,"Is there a better way to declare an empty, typed matrix in MATLAB?",matlab
550,What does the : infix operator do in Haskell?,haskell
551,SVN Error: Expected fs format between '1' and '3'; found format '4',svn
552,PL/SQL: Problem in WHERE clause ( don't know how I can address results from DECODE() function in WHERE clause).,oracle
553,wordpress multiple loops problem,wordpress
554,Using VS 2005 to design abstract forms,visual-studio
555,Wordpress: Two different Permalinks for same Blog,wordpress
556,magento stock management with external inventory management program,magento
557,Magento: Getting Product Url's for Products within a Grouped Product,magento
558,Updating live server from VCS,bash
